Article Title,Author(s),Year,Purpose,Sample Size,Category,Sample,Geographical Representation,Modelling Approach,Techniques/Model Used,Type of Data,Number of Factors,Factors,Type of Rating,Evaluation Measure,Evaluation Category,Study Design,Key Findings,Criticism/Limitation
Actions Speak Louder than Goals: Valuing Player Actions in Soccer,"Tom Decroos, Lotte Bransen, Jan Van Haaren, & Jesse Davis",2019,"Provide a comprehensive evaluation method for every type of player action, while accounting for game context and longer-term effects of actions.",11565,matches,"11,565 games across top European leagues during 2012/13 to 2017/18 seasons",Europe,Ensemble Learning,"VAEP framework to assign value based on the change it brings to a team's likelihood of scoring or conceding, utilizes Catboost",Event Data,51,"Action Type, Result, Body Part, x-coordinates, y-coordinates, Timestamp, Start Distance to Goal, End Distance to Goal, Start Angle to Goal, End Angle to Goal, Goals, goals conceded, Goal Difference, Distance between actions, Elapsed Time between Actions, Possession-Change between Actions, Pass, Cross, Throw, Free Kick (short), Free Kick (Cross), Corner (short), Corner (crosses), Take On, Foul, Tackle, interceptions, Shot, Shot Penalty, Shot Free Kick, Keeper Save, Keeper Claim, Keeper Punch, clearances, Bad control, Offside",Player,VAEP: Valuing Actions by Estimating Probabilities,Player Performance Related,Algorithmic rating/composite,"[1] VAEP captures player contributions more effectively than traditional metrics (goals and assists), identifying valuable players who might not score often. [2] The model is useful for talent scouting and characterizing player styles, helping clubs recruit players who fit specific playing styles.","[1] The framework only values on-ball actions, overlooking defensive contributions made off the ball. [2] Comparing players across different leagues can be challenging due to varying levels of competition. [3] Ratings can get diluted with the amount of actions a player performs."
un-xPass: Measuring Soccer Players Creativity,"Pieter Robberechts, Maaike Van Roy, & Jesse Davis",2023,The study aims to develop a metric that quantifies the level of creativity involved in a player's pass by utilizing machine learning techniques to assess the originality of the pass and its value in terms of increasing the teams chances of scoring a goal.,811,matches,811 matches,Europe,Ensemble Learning,"Machine learning model (XGBoost based on handcrafted features and deep learning CNN model) to identify the likelihood of each possible pass destination, the long-term reward of each passing option and the success probability of each passing option. CDR is measured by the difference of the expected values of the chosen pass option and the predicted typical pass.",Event Data,51,"attacking_player_locations_map, defending_player_locations_map, distance_to_ball_map, distance_to_goal_map, sin_angle_to_ball_map, cos_angle_to_ball_map, angle_to_goal_map, ball_velocity_x_map, ball_velocity_y_map, origin_x, origin_y, destination_x, destination_y, pass_length, delta_x, delta_y, pass_angle, distance_to_goal_origin, angle_to_goal_origin, distance_to_goal_dest, angle_to_goal_dest, distance_to_sideline, ball_height_category, passer_on_ball_time, possession_speed, possession_duration, possession_action_count, nearest_defender_passer, nearest_defender_receiver, nearest_defender_line, packed_opponents_3m, packed_opponents_5m, opponents_in_path, counter_attack_flag, fast_break_flag, free kick, open_play_flag, pass_completed_flag, dribbles_flag, carry_flag, xg_future_shots, xg_future_conceded goals, score_differential, match_minute, half_indicator, home_team_flag, away_team_flag, start_cell_id, end_cell_id, packed_opponents_map, defenders_in_path_map",Player,CDR: Creative Decision Rating,Action-Centric Performance Metrics,Algorithmic rating/composite,[1] The models developed for estimating pass success probability highlight the complexities involved in identifying intended receivers and the importance of contextual factors.,"[1] Set pieces are excluded from the study eventhough they bring in importance into a player's creativity levels, but is not being properly assessed. [2]  One key limitation in modeling pass success is that failed passes are harder to analyze because the intended target is unknown. The model makes assumptions about who the intended receiver was based on distance and angle, which introduces potential inaccuracies, especially in cases where the ball was intercepted early or deflected. [3] Metric awards players who attempt atypical passes but neglects the results or the success rate of the pass, which could bring about inaccuracies in the assessment of players creativity volume."
Uncovering Value Drivers of High Performance Soccer Players,"Maribel Serna Rodríguez, Andrés Ramírez Hassan & Alexander Coad",2019,"To identify the most probable determinants (value drivers and negative value drivers) of a players market value in the Big-5 European leagues, explicitly accounting for model-selection uncertainty and potential endogeneity.",335,player,335 players from the five major European leagues across 2015-2020,Europe,Bayesian Methods,"Bayesian Model Averaging (BMA) utilized to address model uncertainty by generating a weighted average across multiple model specifications .Instrumental Variable Bayesian Model Averaging (IVBMA) addresses endogeneity in player market value and performance measures, enhancing reliability.",Aggregated Data,45,"appearances, Age, Age Squared, National Team Participation, Defender, Midfielder, Forward, Goals, Goals Squared, Experience, Experience Squared, Assists, Concacaf, Conmebol, AFC, UEFA, Goals Previous Season, Premier League, Serie A, Ligue 1, Matches, Matches Squared, both footed, Right Leg, Assistances Matches, First Division, Second Division, Club Administration, Sport Agent, Height, Height Squared, Substitute, Public Attention, Member Union Association, International Players Team, Superstar 2, Under-21 but not Senior Appearance, Appearances in UEFA Champions League, Recognition Under-21, FIFA Cup, EURO UEFA, UEFA Champion, UEFA European, UEFA Super Cup, Team Experience, Constant",Player,Market Value,Financial Related,Predictive,"[1] Very strong evidence (PIP ? 0.99) that market value rises with: Performance (match appearances), Senior national-team participation, Age (positive), Goals scored, U-21 recognition, Age² is a negative driver (implies peak value ? 26 yrs) [2] Positive evidence that club success (playing in 1st division) and club market value (club administration) also matter. [3] Results are robust in IVBMA, though goals fall to positive-evidence tier (PIP ? 0.64).","[1] Transfermarkt valuations blend crowd opinion and media influence introducing measurement noise. [2] Sample restricted to 335 players from 2015/16 season, limiting generalisability across time and lower tiers. [3] aggregation across positions may mask role-specific value drivers (e.g., goalkeepers). [4] cross-sectional design ignores dynamics/unobserved heterogeneity; BMA assumes true model within candidate set; greedy MC3 may miss global optimum; heavy regressor requirement complicates panel extension."
An Improved Evaluation Method for Soccer Player Performance Using Affective Computing,"Wei Liu, Xiang Xie, Sifan Ma, & Yuxiang Wang",2020,"This paper proposes an evaluation method that incorporates affective computing to assess soccer player performance by measuring both the quantity and quality of in-game events. Traditional methods only count event occurrences, like goals or tackles, without considering qualitative aspects. By integrating affective scores derived from post-match reports, this approach aims to provide a more nuanced assessment.",23500,player,"23,500 player observations from Chinese Super League",Asia,"Regression , Neural Network","Affective Computing with Long Short-Term Memory (LSTM) Network for sentiment analysis on post-match reports, assigning affective scores to player actions based on text sentiment. Data Fusion with Linear Regression combines traditional statistics with affective scores to create modified player statistics for evaluation.",Aggregated Data and Text Data,36,"traditional metrics, quality of actions",Player,Player Ratings,Player Performance Related,Predictive,"[1] Players ranked highly by the affective-enhanced model had market values 12.15 million higher than those from traditional rankings, indicating better real-world alignment. [2] Affective scores added significant value in evaluating forward players, as these players have more positive media coverage, indicating bias results.","[1] The models affective scores are reliant on media coverage, which may introduce bias, especially in high-profile or controversial games. [2] Actions like positioning and marking are challenging to quantify using affective scores from post-match reports."
Diverse Machine Learning for Forecasting Goal-Scoring Likelihood in Elite Football Leagues,"Christina Markopoulou, George Papageorgiou & Christos Tjortjis",2024,"The study aims to forecast goal-scoring likelihood among players across four major European leagues using advanced machine learning techniques. It evaluates the predictive accuracy of several machine learning models for player goal predictions. By forecasting goal-scoring likelihood, the model provides an objective, data-driven basis for evaluating strikers and offensive players contributions.",424,player,424 players across four leagues,Europe,Supervised Learning,"XGBoost, gradient boosting, random forest, ridge regression, linear regression, and multilayer perceptron (MLP)",Aggregated Data,36,"Player, Nation, Squad, Position, Age, Born, Matches Played, Starts, minutes played, Goals, Assists, Goals + Assists, Penalty Kicks, Penalty Attempts, Yellow Card, Red Card, Previous Goals, Expected Goals, Non Penalty Expected Goals, Expected Assisted Goals, Non penalty Expected Goals + Expected Assisted Goal + Expected Goals, Non Penalty Expected Goals, Progressive Carries, Progressive Passes, Progressive Received, League, Goals, Assist, Goals + Assist,  Goals + Assists - Penalty",Player,Goal-Scoring Likelihood,Player Performance Related,Predictive,"[1] XGBoost consistently outperforms other models in most datasets, showing strong predictive accuracy, particularly in Serie A with an MAE of 1.29. [2] Expected Goals (xG) and previous goals are critical features as they provide added context into the actions that take place.","[1] The model heavily depends on historical scoring data, which might limit its predictive power for new players or those returning from injuries. [2]  The ensemble and neural models, while accurate, may lack transparency, making it challenging for clubs to understand the factors influencing predictions. [3] The studys focus on top-scoring players might introduce selection bias, as lower-scoring players or defenders are less represented in goal-scoring prediction models."
Using composite performance variables to explain football players market values,Christer Thrane,2024,The present study examines how Fotmob's composite performance index (ratings) is associated with football players market values as defined by the Norwegian website FotMob and by the German website Transfermarkt.,240,matches,240 Eliteserien matches,Europe,Regression,Regression analysis to find relationship between FotMob ratings and market values neet of the independent variables typically used in previous regression models,Aggregated Data,35,"FotMob composite index, minutes played, Goals, Assists, Yellow cards, Red cards, Footedness, National-team cap dummy, appearances, Age, Age squared, Position, Nationality region, Year of contract signing, Year of contract termination, European-cup matches, Domestic titles/wins, Previous-clubs count, Team fixed-effects",Player,Transfermrkt Market Value & Fotmob performance index,Financial Related,Explanatory (associational/regression),"[1] Fotmob performance index contributed with unique explanatory power regarding market values. [2] Fotmob performance index also contigent on player's age (younger), player positions (midfielder/striker), and players with longer contract durations. [3] Certain independent variables effects on market value is exaggerated when not adjusted for the composite performance index. [4] Fotmob performance index has ample explanatory power when predicting ratings for players when tested against subjective ratings from reporters.",[1] No contextualized information on the statistical data. [2] Potential issues with multicolinearity due to large usage of independent variables. [3] Small dataset may not provide enough predicitve power to analysis.
Forecasting Football Match Results Using a Player Rating Based Model,Benjamin Holmes & Ian G. McHale,2024,"The study introduces a player-based model for forecasting football match results, with a focus on using individual player ratings to predict match outcomes. It aims to improve upon traditional team-based models by incorporating player-level data to better capture the dynamic nature of team strength.",6824,matches,"6,824 matches across 9 years",Europe,Regression,Player-based model using Whoscored ratings,Event Data,32,"WhoScored match rating, league dummy, player dummy, home advantage, Defending-player position dummies, position, Attacking team formation , Defending team formation, Position-specific intercept for each logit",Player,AWS: Average Whoscored Rating,Player Performance Related,Predictive,[1] The inclusion of adjusted player ratings and interaction weights offers better performance in terms of Brier scores and ROI. [2] The player-based model (skellamfull) improves predictive accuracy compared to team-based models.,"[1] Whoscored ratings are not adjusted to league quality. [2] some players appear in a small number of games. Taking a simple average of their performance ratings to estimate how they can be expected to perform in the future is likely to result in volatile, unrealistically high or low average ratings."
Performance and Actual Pay in Norwegian Soccer,Christer Thrane,2019,"This study examines the relationship between player performance and pay in Norwegian soccer, specifically within Eliteserien, Norway's top league. It aims to determine whether market values can be a reliable proxy for actual earnings in performance-pay studies.",240,player,"240 players from the 2014 season of Eliteserien, Norways premier soccer league",Europe,Regression,Ordinary Least Squares (OLS) regressions to compare market value-based estimates with actual earnings.,Aggregated Data,29,"Age, Age Squared, Norwegian, Foreign, Positions, appearances, National-Team Caps, Mean Journalist Ratings, minutes played Played, Player earnings, Player Market Values, Player Earnings (logged), Player Market Values (logged), fixed effects for teams",Player,Player Earnings and Market Value,Financial Related,Explanatory (associational/regression),"[1] The study demonstrates that player longevity and consistent performance (e.g., club appearances, national team caps) contribute significantly to actual pay, highlighting the value of rating systems that account for sustained career achievement. [2] Market values might misrepresent a players consistent contributions and overrate single-season impacts, suggesting that actual salary-based ratings could yield more reliable long-term evaluations.","[1] Eliteserien's distinct financial environment may not generalize to larger leagues. [2] The study relies primarily on ratings and basic performance metrics, lacking deeper game metrics like assists or defensive actions. [3] Lagged performance and earnings data potentially overlook more immediate impacts of performance on pay."
Football analytics: a Higher-Order PLS-SEM approach to evaluate players performance,Mattia Cefis & Maurizio Carpita,2022,"This paper looks to adopt a Higher-Order PLS-SEM approach to the sofifa KPIs (e.g. Key Performance Indicators) in order to compute a composite indicator and compare it with the well-known overall index from EA Sports, so that player evaluation is more complete.",106,player,106 midfield player from Serie A 2015/16,Europe,"Unsupervised Learning , Structural Modelling","Higher-Order PLS-SEM to measure causality relations between the 6 sofifa traits and the basic statisical variables (manifest variables), and find out which variables are important.",Aggregated Data,29,"Acceleration, Sprint Speed, Agility, Balance, Reactions, Ball Control, Dribbling, Vision, Crossing, Short Pass, Long Pass, Finishing, Shot Power, long shots, Volleys, Penalties, Heading Accuracy, Strength, Stamina, Jumping, Aggression, interceptions, Marking, Standing Tackle, Sliding Tackle, Curve, FK Accuracy, Positioning, Composure",Player,Manifest variables measuring their importance towards Latent variables,Player Performance Related,Predictive,"[1] When comparing with different datasets (SoFIFA and FIFA), loadings are calculated differently which means that different datasets can conjure different causality relationships with the main attributes or KPI. [2] FIFA Cards index achieved a better good of fit, but the correlation with EA overall index is similar in both groups.","[1] The PLS-SEM model simplifies the relationships between variables by treating some stats as causes and others as effects (e.g., shots leading to higher performance). However, football is a dynamic game with complex interactions between players, teams, and tactics that might not fit neatly into this framework. [2] The authors assume that the stats (MVs) ""form"" the latent variables (LVs) like attacking and defending, meaning they believe the stats cause the latent variables. Misunderstanding whether variables are formative or reflective can distort the results. [3] The model treats the chosen variables as equally important within their groupings. However, not all performance metrics (e.g., dribbles vs. key passes) hold the same weight in contributing to overall performance."
Predictive Analysis of Football Player Market Value Using Machine Learning,Gokul Krishna and Dr. Anjana S Chandran,2021,"This study aims to predict the market values of football players by leveraging machine learning models, focusing on improving valuation accuracy for financial and strategic decisions in club management.",N/A,N/A,N/A,Europe,Regression,Linear regression and supervised machine learning models,Aggregated Data,12,"Age, Height, Weight, Release Clause, Growth Potential, Overall Rating, International Reputation, minutes played Played, Passes, Goals, Assists, appearances",Player,Market Value,Financial Related,Predictive,"[1] Regression-based methods, provided strong accuracy when predicting market values for mid-tier players, where market volatility is moderate. [2] Key performance metrics (e.g., goals, assists) and demographic data significantly impacted market value prediction.","[1]  The model struggles with the market values of high-tier players due to intangible factors, not quantifiable with traditional metrics. [2]  The models ability to generalize across different leagues and tiers may be limited without additional market-specific training data."
How Soccer Players Box Score Statistics Effect on their Rating and Market Value,Haoyang Yan,2020,"This study explores how box score statistics influence players ratings and market values. By introducing a new statistic, Box Rating (BR), the research seeks to quantify player performance based on 26 game metrics and use statistical models to assess the relationship between these metrics, player ratings, and market valuations.",2024,player,"2,024 players from Europes top five leagues (Premier League, La Liga, Serie A, Bundesliga, Ligue 1) over three seasons (2017-2020)",Europe,Regression,Multiple Linear Regression used to derive the Box Rating (BR) by regressing 26 box score variables against player ratings.,Aggregated Data,26,"goals, assists, key pass, turnovers, dispossession, clearances, saves, tackles won, interceptions, shots total, shot-adjusted distance, shot-on-target %, penalty taken, long pass, long pass accuracy %, short passes, short-pass accuracy %, dribbles, dribbles %, aerial duels, aerial duel success %, own goals, fouls drawn, fouls committed, yellow cards, red cards",Player,Box Rating and Predicted Market Value,Financial Related,Predictive,"[1] Goals and assists were the most impactful on BR and ratings, while negative actions (e.g., fouls, yellow cards) diminished ratings. [2] BR showed a strong correlation (0.89 R²) with player ratings from WhoScored, validating it as a robust performance metric. [3] Market value correlates not only with BR but also with player age and popularity, indicating that external factors significantly affect valuations.","[1] Goalkeepers showed less correlation with BR due to fewer box score metrics applicable to their role, complicating their valuation. [2] Using Transfermarkt values and FIFA20 ratings may introduce bias from subjective or video game-based evaluations. [3] No contextualized information on the statistical data."
Racial bias in newspaper ratings of professional football players,"Francesco Principe, & Jan C. van Ours",2022,"This study investigates the presence of racial bias in Italian sports newspapers' ratings of professional football players, focusing on whether black players receive lower ratings than non-black players despite comparable objective performance metrics. By examining ratings from three Italian newspapers, the study seeks to understand the potential influence of race on subjective evaluations in sports media.",1835,player,"1,835 player-season observations for outfield players in Italys Serie A over nine seasons (2009-2018), excluding goalkeepers",Europe,Regression,"Ordinary Least Squares (OLS) Regression is used to establish the relationship between player race and ratings. Unconditional Quantile Regression (UQR) provides distributional analysis, highlighting differences in racial bias across rating quantiles.",Aggregated Data,26,"goals, assists, shots per game (SpG), pass-success %, aerial duels won, tackles, interceptions, long pass, through ball, shots off-target, shots on-post, shots on-target, shots blocked, dispossession, inaccurate crosses, inaccurate corners, yellow cards, red cards, age, age squared, international-capped dummy, minutes played played, on-field position dummies (defender = reference; midfielder; forward), team strength, race",Player,Newspaper Ratings,Player Performance Related,Explanatory (associational/regression),"[1] Black players tend to receive significantly lower ratings in the lower performance quantiles, particularly in Corriere and TuttoSport, suggesting unconscious bias among evaluators at this range. [2] While media ratings exhibit racial bias, club wages do not reflect such bias, possibly due to the competitive nature of football clubs in valuing player skills objectively.","[1] Goalkeepers were excluded due to different rating standards, limiting generalizability to this position. [2] The study does not delve into why media bias persists, leaving open the question of whether it stems from unconscious discrimination or reader preferences."
Machine Learning Models Reveal Key Performance Metrics of Football Players to Win Matches in Qatar Stars League,Jassim Almulla & Tanvir Alam,2020,The study aims to develop machine learning models to identify key performance metrics that contribute to winning football matches in the Qatar Stars League (QSL). It seeks to use these metrics to create a classification model that can predict whether a team will win or lose a match based on player performance.,1121,matches,"1,121 matches",Asia,Supervised Learning,Classification framework in the machine learning context,Aggregated Data,25,"Blocks, clearances, Corners, Crosses, Dribbles, Fouls, Free-kicks, interceptions, Offsides, Red cards, Shots Missed, Shots on Target, Successful Passes, Tackles, Unsuccessful Passes, Yellow cards, Standing Distance, low-speed distance, moderate-speed distance, high-speed distance, elevated-speed distance, very-high-speed distance, Number of Forwards, Number of Midfielders, Number of Defender",Player,Key Performance Metrics,Team Performance Related,Predictive,"[1] Shots on Target by Forwarders is the most significant metric, Successful Passes, High-Speed Distance, Defenders' Role, Fair Play are determinants of winning. [2] The Logistic Regression (LR) model was the best performing, achieving over 80% accuracy in predicting match outcomes.","[1] The study excludes draw matches from the analysis, focusing solely on wins and losses, the model may be oversimplifying the dynamics of football matches and missing out on a third, often crucial, outcome. [2] No contextualized information on the statistical data. [3] The data used is specific to the Qatar Stars League (QSL), which might not be as comprehensive as data from higher-profile leagues, the model may not be robust enough to apply to other leagues or future seasons without retraining. "
