Article Title,Author(s),Year,Purpose,Sample Size,Category,Sample,Geographical Representation,Modelling Approach,Techniques/Model Used,Type of Data,Number of Factors,Factors,Type of Rating,Evaluation Measure,Evaluation Category,Study Design,Key Findings,Criticism/Limitation
How to be praised in sports newspapers: a performance analysis from soccer matches,"Hugo Silva, Fábio Yuzo Nakamura, Vajiheh Javani, & Rui Marcelino",2023,"This study investigates how performance metrics impact player ratings in Portuguese sports newspapers, comparing these ratings with data from SofaScore to assess biases and the factors most valued by the media. It aims to understand the subjective elements influencing player evaluations in media versus data-driven metrics.",5,matches,5 Portuguese first division games from 2021/22 season,Europe,Regression,"Pearsons Correlation Analysis is used to measure the agreement between newspaper ratings and SofaScore for various player positions. Linear Regression Analysis identifies the performance variables with the strongest impact on newspaper ratings, assessing the relationship between player actions and media evaluations.",Aggregated Data,12,"goals, saves (GK only), assists, successful exits (GK sweeps), accurate passes, key pass, successful dribbles, ball losses, shots on target, tackles, duels won, playing position",Player,Newspaper Ratings,Player Performance Related,Explanatory (associational/regression),"[1] Offensive contributions, particularly goals and assists, were the primary drivers of high ratings across all newspapers. For instance, forwards received high ratings based on goal scoring, while central midfielders benefited from assists. [2] Goalkeepers received higher ratings in newspapers than in SofaScore, with newspapers valuing actions like successful exits and duels won, highlighting a bias towards defensive actions. [3] Each newspaper displayed unique biases; for example, A Bola and Record rated goalkeepers favorably for defensive actions, while O Jogo valued offensive contributions more broadly. Which means bias introduces subjective elements in the rating of players.","[1] Newspapers favored offensive metrics for rating defenders and midfielders, potentially disadvantaging defensive players whose actions dont directly impact goals or assists. [2] The studys findings are based solely on the Portuguese league, limiting generalizability across international leagues and different media environments. [3] Despite correlations, media ratings showed subjective bias, favoring visible actions (e.g., goals, saves) over other contributions, which may distort player evaluations."
What are the key performance indicators for a top position in the German Bundesliga?: 2022-2023 Bundesliga season example,Gizem Baskaya,2023,"Compare performance of teams using technical, tactical and physical performance parameters according to league rankings, reveal its effect and relationship",612,matches,612 matches played in Bundesliga,Europe,Regression,MANOVA test to reveal the difference between the teams and effect sizes were reported. Pearson Correlation Test was applied to determine the relationships between the performance parameters of the teams and the points they collected,Aggregated Data,12,"Possession, passing accuracy, goals, Goals conceded, Total shots, Duels won, Aerial duels won, Total points, Running-distance per match (km), Total running-distance (km), High-speed runs, Sprints",Team and Player,League ranking,Team Performance Related,Explanatory (associational/regression),"[1] Goals scored, goals conceded, total shots and total points are in favor of top ranked teams. [2] Possession, pass accuracy, goals scored, total shots (+) & goals conceded and aerial duels won (-) are highly correlated. [3] Running parameters have no correlation with points.","[1] Goalkeeping parameters are not considered. [2] Ignored the play without the ball in terms of their physical performance, and could not be reported on the data site. [3] No context in playing position is considered."
A weighted plus/minus metric for individual soccer player performance,Steven R. Schultze & Christian-Mathias Wellbrock,2018,"This study applies plus/minus ratings by enhancing the weightage of goals based on their importance and accounting for the relative strength of opponents. It aims to provide a more precise measure of player impact, especially given soccer's unique dynamics, such as lower scoring and limited substitutions.",102,matches,102 Bundesliga games from 2012/13 season,Europe,Custom Rating Systems,"Weighted Plus-Minus weights goals differently based on impact, while accounting for opponent strength using betting odds.",Event Data,3,"Player Presence Indicator, Opponent-strength Weight,  Goal-importance Weight",Player,WPM: Weighted Plus/Minus,Player Performance Related,Algorithmic rating/composite,"[1] The WPM metric showed enhanced differentiation across player contribution as it provided more nuanced insights into player impact than the traditional plus-minus. [2] WPM identified key players based on their positioning. [3] By mapping shots conceded or taken with key players on and off the field, spatial analysis confirmed that weaker players expose specific areas of the pitch.","[1] Since it factors in team performance relative to expectations, WPM scores favor players from successful teams, potentially skewing cross-team comparisons. [2] The models reliance on betting odds and GIS mapping requires extensive, precise data, which can be time-intensive to collect and log. [3] Variability in league strength complicates direct comparisons between leagues, as well as across long time spans within the same league."
Team Composition in PES2018 Using Submodular Function Optimization,"Yifeng Zeng, Gaoyang Shen, Bilian Chen & Jing Tang",2019,This study explores an automated team composition method in Pro Evolution Soccer 2018 (PES2018) by framing team selection as a submodular optimization problem. The goal is to recommend an optimal team that maximizes skill coverage and meets budget constraints.,9563,player,"9,563 players from the PES2018 database",Global,Optimization Techniques,"Submodular function optimization techniques, applying a greedy algorithm and an improved Cost-Effective Forward selection Greedy (CEFG) algorithm to optimize team selection.",Aggregated Data,11,"Attacking Prowess, Ball Control, Dribbling, Low Pass, Lofted Pass, Finishing, Heading, Defensive Prowess, Speed, Goalkeeping, Estimated Salary (Cost)",Player,Team's Win Rate,Team Performance Related,Algorithmic rating/composite,"[1] The Elo-based system identified key players whose ratings contributed significantly to team success. [2] Player-based ratings outperformed team-only ratings in match outcome predictions, supporting the systems use for evaluating lineup strength. [3] The rating system proved adaptable across competitions and was effective for player ranking, suggesting usefulness for scouting purposes in identifying high-impact players.","[1] Using PES2018 data limits generalizability, as attributes and skills may not reflect real-world player dynamics. [2] The study estimates player salaries based on ratings, which may not accurately capture true player value in complex sports markets. [3] By constraining team composition to a single formation, the model may lack flexibility in adapting to varied game strategies."
Augmenting Adjusted Plus-Minus in Soccer with FIFA Ratings,"Francesca Matano, Lee F. Richardson, Taylor Pospisil, Collin Eubanks, & Jining Qin",2018,"Introducing APM onto football by combining FIFA ratings into a single metric to solve the issue of plus minus ratings in football, where collinearity is an issue",1140,matches,1140 English Premier League games from 2015/16 - 2017/18,Europe,Bayesian Methods,Bayesian Regression,Aggregated Data,2,"Player Presence Indicator, FIFA rating",Player,Augmented APM: FIFA ratings + APM,Player Performance Related,Algorithmic rating/composite,[1] Augmented APM predicts better than both standard APM and a model using only FIFA ratings.,"[1] lack of event data availability with advanced metrics [2] too much computing usage implemented to convert play-by-play data into statistical table for every participating player, not efficient."
Estimation of Market Values of Football Players through Artificial Neural Network: A Model Study from the Turkish Super League,Tugbay Inan & Levent Cavas,2021,"The study develops an Artificial Neural Network (ANN) model to estimate the market values of Turkish Super League (TSL) players using performance-based parameters, with the goal of offering an objective valuation approach based solely on performance metrics.",236,player,236 midfield players from the Turkish Super League,Europe,Neural Network,Artificial Neural Network (ANN) with optimization of hidden layers and backpropagation algorithms.,Aggregated Data,11,"minutes played-played, Goals, Expected Goals, Assists, Expected Assists, Defensive-duels-won %, Tackle-success %, Shots-on-target %, Short-& Middle-pass accuracy %, long pass accuracy %, Pass-to-penalty-area accuracy %",Player,Predicted Market Value,Financial Related,Predictive,"[1] ANN was able to predict market values efficiently when simulated data was used, but not with real data from OPTA, showing how difficult it is to evalaute players based on market value using real performance data as Market value considers different aspects outside the pitch. [2] Metrics like minutes played, pass accuracy, and shots on target were influential in determining market values, highlighting the importance of consistent play and skill.","[1] Lack of correlation with real-world data indicates limitations in using only performance metrics to predict market value. [2] Simulated data may not reflect real-world complexities, limiting model applicability in actual transfer valuations. [3] No contextualized information on the statistical data."
Unveiling Multi-Agent Strategies: A Data-Driven Approach for Extracting and Evaluating Team Tactics from Football Event and Freeze-Frame Data,"Calvin Yeung, Rory Bunker, & Keisuke Fujii",2024,The study proposes a data-driven framework for extracting and evaluating team tactics in football using event and freeze-frame data. It aims to address limitations in current methods by including contextual information and sequential patterns to offer a more holistic evaluation of team tactics.,512,matches,512 matches,Europe,Neural Network,"The neural marked spatio-temporal point process (NMSTPP) model is used to model and predict team behaviors, incorporating temporal and spatial data from freeze-frame inputs.",Event Data and Tracking Data,11,"Zone ID, Inter-event time, x-coordinate, y-coordinate, distance to goal, angle to goal, Pass, Dribble, Cross, Shot, Possession-Ending Event",Team,Holistic Possession Utilization Score (HPUS),Team Performance Related,Algorithmic rating/composite,"[1] Five distinct team tactics were identified (e.g., pass-based, dribble-based, opponent wing-based). These patterns accounted for up to 43% of all possession strategies. [2] The integration of freeze-frame data significantly enhanced the predictive accuracy of the NMSTPP model, allowing for more precise evaluations of team tactics and performance.","[1] The model requires detailed event and freeze-frame data, which may not be available for all matches. [2] Some tactical insights could benefit from further validation through expert analysis, as the model relies heavily on statistical patterns. [3] The study focuses on attacking phases, with limited analysis of defensive tactics or transitions."
Not Every Pass Can Be an Assist: A Data-Driven Model to Measure Pass Effectiveness in Professional Soccer Matches,"Floris R. Goes, Matthias Kempe, Laurentius A. Meerhoff, & Koen A.P.M. Lemmink",2019,"The paper presents a new model for evaluating pass effectiveness in soccer, focusing on how well a pass disrupts the opponent's defense. The goal is to quantify pass effectiveness beyond traditional measures that overemphasize forward passes and scoring opportunities.",18,matches,18 matches,Europe,Custom Rating Systems,"Defensive Disruptiveness Score (D-Def), which uses spatiotemporal data to evaluate the movement of defending players following a pass. The D-Def score quantifies the disruption caused to the defense following a pass.  It employs Principal Component Analysis (PCA) to derive key metrics related to defensive organization and disruption. The model considers movement and organizational changes in the opponent's defense to rate the effectiveness of passes.",Tracking Data,10,"team-centroid X, team-centroid Y, defence-line centroid X, defence-line Y, midfield-line X, midfield-line Y, attack-line X, attack-line Y, team surface-area (convex-hull), team spread (Frobenius norm of player positions).",Player,D-Def score,Action-Centric Performance Metrics,Algorithmic rating/composite,"[1] Long passes and fast passes in a longitudinal direction have the highest correlation with disrupting the opponent's defense. [2] Players who create more longitudinal movement in the defense are better passers according to the model. [3] Overall individual movement of players correlate with disruptiveness of defensive organization, the more the players move, the more unstable their defence is.","[1] The study only includes completed passes, meaning incomplete passes are excluded from the analysis, making it biased towards a certain style of play. [2] Study evaluates all passes by giving it a value, not condusive when calculating overall performance where we are interested in looking at the game changing moments, as proven by the study that progressive actions make the most of the disrupted defences. [3] It doesnt account for the relationship between pass effectiveness and game outcomes (e.g., scoring goals)."
Discovering associations between players performance indicators and matches results in the European Soccer Leagues,Maurizio Carpita & Silvia Golia,2021,"Using Bayesian Network to mine the relations between players' performance indicators of 4 different roles and the results of matches, and to predict the wins of the home team.",18873,matches,"18,873 matches",Europe,Bayesian Methods,Bayesian Network,Aggregated Data,10,"Home Forward Overall Performance Indicator, Home Midfielder Overall Performance Indicator, Home Defender Overall Performance Indicator, Home Goalkeeper Overall Performance Indicator, Away Forward Overall Performance Indicator, Away Midfielder Overall Performance Indicator, Away Defender Overall Performance Indicator, Away Goalkeeper Overall Performance Indicator, Home ELO, Away ELO",Player,Overall performance indicator (predictor to result of match),Team Performance Related,Predictive,"[1] Midfielders are important to obtaining a winning result for the home team, while defenders are more important to the away team. [2] Bayesian Network built with OPI has the same predictive power as Bayesian Network built with ELO but BN with OPI describes the dependence/independence relationships amongst variable","[1] Model doesn't incorporate contextual information, in the ratings. [2] No description on OPI's calculcations. [3] OPI generated from scouted perspectives which may be derived without statistical basis."
Rating Player Actions in Soccer,"Uwe Dick, Maryam Tavakol, & Ulf Brefeld",2021,"This study proposes a data-driven model to rate soccer player actions, focusing on ball possession phases and predicting player movements. It evaluates players based on their contribution to team success during these phases using trajectory data.",54,matches,54 Bundesliga matches in the 2017/18 season,Europe,Neural Network,"A Graph Recurrent Neural Network (GRNN) is employed to predict player trajectories and the success of ball possession phases. The GRNN processes the interaction between players and the ball, using a fully connected graph where players and the ball are represented as nodes.",Tracking Data,8,"x-coordinates, y-coordinates, x-velocity, y-velocity, team-in-possession flag, has-ball flag, attacking-direction flag, goalkeeper flag. ",Player,Value functions for different player actions,Action-Centric Performance Metrics,Algorithmic rating/composite,"[1] The GRNN accurately predicts both player movements and the outcome of possession phases. [2] The model highlights the importance of off-ball actions, such as defensive positioning and running into space. [3] The model significantly outperforms a baseline convolutional neural network in predicting successful ball possession outcomes.","[1] The model doesnt account for the players physical state (e.g., fatigue) or body posture, limiting its accuracy in assessing defensive actions. [2] Success is measured by entering a ""dangerous zone"" rather than scoring, which could overlook critical defensive contributions."
Data-driven exploratory approach on player valuation in football transfer market,"Yunhu Kim, Khac-Hoai Nam Bui, & Jason J. Jung",2019,"To offer an objective, data-analytics workflow that predicts post-transfer performance and classifies players by value (performance × transfer fee), allowing clubs to spot efficient bargains and overpriced signings.",N/A,N/A,N/A,Global,"Regression , Supervised Learning , Unsupervised Learning","Regression analysis to predict player performances after trasnfer. Boruta Algorithm for feature selection to identify important attributes of each position, K-Means Clusterting to classify players into 4 catgoeries based on performance and transfer fee.",Aggregated Data,26,"appearances, minutes played Played, Total Goals, Total Assists, Shots, Dribbles, fouls won, Offsides, Bad Control, key passes, Passes, Pass Success Percentage, Crosses, long pass, through ball, Tackles, interceptions, Fouls, Offside Won, clearances, Dribbled Past, Outfielder Blocks, Own Goals, Expert Rating, Transfer Fee",Player,Categorized into 4 clusters: LPLF: Low performance and low transfer fee. LPHF: Low performance and high transfer fee. HPHF: High performance and high transfer fee. HPLF: High performance and low transfer fee.,Financial Related,Predictive,"[1] The Boruta algorithm was effective in identifying important performance attributes like assists, dribbles, and key passes for different positions. [2] Clustering results reveal that transfer fees are not always aligned with player performance, as some high-fee players underperform post-transfer, while lower-fee players overperform, which suggests transfer fees are often impacted by different factors that are not considered in the study (club finances). [3] Passing performances and dribbling are critical in the evaluation of players in most position according to the  Boruta algorithm, which shows that a player's technical ability is high regarded in their value.","[1] Transfer fee driven by popularity, inflation, home-grown rulesfactors not modelled.  [2] Transfer fee is not suitable as a variable due to the intangible factors like club finances not being included in the study. Regression analysis done on the transfer fee of the player misleads the true quality and performance of the player. [3] No goalkeepers, so findings cannot generalise to full squads. "
Predict the Value of Football Players Using FIFA Video Game Data and Machine Learning Techniques,Mustafa A. Al-Asadi & Sakir Tasdemir,2022,"This study proposes a machine learning model to predict football players market values using data from FIFA 20, aiming to replace subjective, expert-based evaluations with a quantitative approach for more objective player valuation.",17980,player,"17,980 players from FIFA 20 video game data",Global,"Regression , Ensemble Learning , Supervised Learning","Compares Linear Regression, Multiple Linear Regression, Decision Trees, and Random Forest Regression, with Random Forest providing the best results.",Aggregated Data,7,"Age, Height, Potential, International reputation, Weak foot, Team position, Passing",Player,Predicted Market Value,Financial Related,Predictive,"[1] Random Forest achieved the highest accuracy (R² of 0.95), showing it effectively captures the complexity of market value predictions. [2] The features potential and international reputation are among the most influential for determining market value, highlighting the importance of player reputation beyond skill alone. [3] The study finds that limiting features to a core set (7 attributes) does not significantly affect model performance, simplifying predictions.","[1] Using FIFA 20 data limits the models applicability, as game-based ratings may not fully reflect real-world performance and transfer market dynamics. [2] The absence of real transfer data as a comparison restricts validation, potentially affecting the models generalizability to actual market scenarios."
The Betting Odds Rating System: Using soccer forecasts to forecast soccer,Fabian Wunderlich & Daniel Memmert,2018,Using betting odds of single matches to draw conclusions about quality of teams,14931,matches,"14,931 matches",Global,"Custom Rating Systems , Regression","ELO calculations implemented, replacing actual result with expected results in terms of betting odds.",Aggregated Data,6,"Match Result, Goal Difference, Betting-market probability of home win, Betting-market probability of draw, Betting-market probability of away win, Fixed home advantage offset",Team and Player,ELO-Odds (Betting Odds based ELO Team Ratings),Team Performance Related,Algorithmic rating/composite,"[1] Outperform traditional ELO models (ELO-Goals & ELO-Results), showing that betting odds prior to matches contain more relevant information and more valuable insights to performance analysis than the result of the match itself.","[1] Using intangible home and away factors undermines the quality of team performance in the general state of play, where they are judged on equal grounds. [2] Ratings constructed prior to the match as a measure for the actual result, ignoring the performance that is observable during or after the match which would cause inconclusive result of the player/team performance in the given game. [3] It can only extract team specific information from the betting odds and aggregate them in the ratings, but exclude relevant information such as injuries or line ups."
Comparing Bottom-Up and Top-Down Ratings for Individual Soccer Players,Lars Magnus Hvattum & Garry A. Gelade,2021,This paper compares two approaches for evaluating individual soccer players: bottom-up ratings (which value individual player actions) and top-down ratings (which assess team performance and distribute credit to players). It aims to determine which method is more reliable and valid for predicting match outcomes and ranking player performance.,18047,matches,"18,047 matches over 10 seasons (2009/10 to 2018/19) from Europes top five leagues",Europe,"Custom Rating Systems , Ensemble Learning","Bottom-up rating: The VAEP (Valuing Actions by Estimating Probabilities) model, which calculates the value of player actions by estimating how they affect the probability of scoring or conceding goals. Top-down rating: The plus-minus (PM) rating, which measures the goal differential achieved by a team when a player is on the field, adjusted for teammate and opponent strength.",Event Data,24,"touches, successful passes, total pass length, pass-completion percentage, pass value, key pass, through ball, Goals, shots on target, assists, successful take-ons, ground duel success, successful aerial duels, aerial duel success %, interceptions, tackles made, clearances, recoveries, saves, save-to-shot ratio, Total cards, fouls committed, dispossession,  mean pass length, player-presence, home field, league, red-card dummies",Player,VAEP Ratings and PM Ratings,Player Performance Related,Explanatory (associational/regression),"[1] PM ratings are more reliable and provide better predictions of match outcomes than VAEP ratings. [2] VAEP ratings, while detailed, were less consistent when tested across different data sets and less effective in predicting match results. [3] Hybrid ratings combining PM and VAEP did not significantly improve performance compared to PM alone.","[1] VAEPs reliance on detailed event data can make it less stable and harder to generalize, particularly for smaller data sets. [2] VAEP doesnt account for opponent or teammate quality as thoroughly as PM ratings. [3] Both models lack consideration for player interaction effects (e.g., chemistry between players) and do not handle off-ball actions."
