Article Title,Author(s),Year,Purpose,Sample Size,Category,Sample,Geographical Representation,Modelling Approach,Techniques/Model Used,Type of Data,Number of Factors,Factors,Type of Rating,Evaluation Measure,Evaluation Category,Study Design,Key Findings,Criticism/Limitation
On the relationship between +/ ratings and event-level performance statistics,Garry A. Gelade & Lars Magnus Hvattum,2020,"This study investigates the relationship between event-level performance statistics (e.g., passes, interceptions) and the Plus-Minus (PM) rating system, a player rating methodology widely used in sports analytics. The paper examines the effectiveness of integrating specific player events to improve the predictive power and reliability of PM ratings for football.",16430,matches,"16,430 matches across five top European leagues",Europe,Regression,Multiple Linear Regression analyzes event-based data to assess variance in PM ratings. Recursive Feature Elimination to refine predictor variables for each position-specific PM model.,Event Data,24,"Touches, Successful Passes, Total Pass Length, Pass Completion, Passes Completed, Pass Value, key pass, through ball, goals, Shots on Target, Assists, Successful Take-Ons, Successful Take Ons%, Ground Duels Won, Successful Aerial Duels, Successful Aerial Duels %, Aerial Duels Won, interceptions & Blocks, Tackles Made, clearances, recoveries, Saves (out-field), Saves-to-Shots Ratio (keepers only), Total cards, fouls, Dispossession, Mean Pass Length",Player,Enhanced Plus/Minus Ratings,Player Performance Related,Explanatory (associational/regression),"[1] Event-level statistics explain 22%-38% of variance in PM ratings, suggesting moderate alignment between top-down (PM) and bottom-up (event-based) metrics. [2] Event factors like key passes and interceptions strongly influence ratings for forwards and defensive midfielders, while goalkeepers rely heavily on saves and pass completion. [3] Combining event-based data with PM ratings improves match outcome predictions slightly but highlights PM ratings limitations as player-specific performance measures.","[1] PM ratings often incorporate both a player's direct contributions and contextual factors like team dynamics, which can dilute or misrepresent an individual players true performance. [2] The PM model favors forwards and attacking players, as these roles more directly affect score differentials. [3]  PM ratings for players with limited playtime or inconsistent performance can be highly variable, potentially affecting reliability in less predictable positions."
Goalkeeper Performance: Analysis of Goalkeepers Contribution to Their Teams Build-up under the Opponents Pressure in the 2018 World Cup,"Dimitrios Mikikis, Yiannis Michailidis, Athanasios Mandroukas, George Mavrommatis, & Thomas Metaxas",2021,"This study assesses goalkeeper performance under high-pressure situations during the 2018 FIFA World Cup, focusing on their contribution to offensive build-ups. The analysis examines how goalkeepers adapt in transition phases, especially when initiating play while under pressure from opponents.",64,matches,64 World Cup matches,Global,Unsupervised Learning,"Descriptive and Hierarchical Cluster Analysis to cluster goalkeepers into groups based on pass accuracy, distances, and success under pressure.",Aggregated Data,14,"Total passes, Passes under pressure, Passes without pressure, Correct passes under pressure, Incorrect passes under pressure, Correct passes without pressure, Incorrect passes without pressure, Short-distance passes (< 23 m), Long-distance passes (> 23 m),  Ground passes,  Air passes, One-touch passes, Two-touch passes, Three-or-more-touch + dribbles-and-pass actions",Player,Passing performance,Action-Centric Performance Metrics,Descriptive (summaries/associations),"[1] Goalkeepers showed a strong preference for air and long-distance passes under pressure, accounting for nearly 80% of distribution decisions, to maintain possession. [2] Goalkeepers with higher correct pass rates under pressure correlated significantly with match wins, highlighting tactical impact and importance of distribution in goalkeeping. This study supports integrating ball distribution metrics into goalkeeper ratings","[1] The study focuses mainly on distribution skills, omitting defensive and shot-stopping metrics that are critical to goalkeeper evaluation. [2] The study depends on broadcast footage, which may limit accuracy in observing subtle positioning and tactical responses."
On the use of passing network indicators to predict football outcomes,"Riccardo Ievoli, Lucio Palazzo & Giancarlo Ragozini",2021,"This study investigates the predictive value of network-based metrics derived from passing networks in determining match outcomes. It seeks to assess whether these metrics can enhance predictive models for winning probabilities, using both network indicators and traditional match variables.",96,matches,"96 matches from the 2016-2017 UEFA Champions League Group Stage, involving 32 top European teams",Europe,Graph-Based Modelling,"Binomial Logistic Regression (BLR) and compares it with machine learning models like Artificial Neural Networks (ANN), Naive Bayes (NB), and Random Forest (RF)",Event Data,24,"UEFA club ranking, domestic-league ranking, home/away dummy, shots, offsides, fouls committed, Possession, total team running-distance, passes, network diameter, largest clique size, count of maximal cliques, reciprocity, global clustering, pass-success %, diversity (entropy), hubs, authorities, PageRank, assortativity, average neighbourhood degree, betweenness centrality, closeness centrality, degree centrality",Team and Player,Player Network Centrality,Team Performance Related,Predictive,"[1] The inclusion of network-based indicators enhances model accuracy, with BLR achieving higher AUC and accuracy than models without network data, showing that contextual element of a player's passing adds value to the accuracy of the model. [2] Betweenness centralization and network diameter significantly contribute to predicting a teams probability of winning, and thus gauging a player's role in creating connectivity, highlighting influential players in passing networks. [3] Among the tested models, BLR performs well with a balance between sensitivity and specificity, suggesting it is a reliable approach for win prediction.","[1] The study focuses solely on passing networks without considering positional or spatial data, which could provide critical context on how passes and formations impact outcomes. [2] The model is developed using data from high-profile UEFA Champions League teams, which may limit applicability to teams with different playing styles or less structured passing dynamics."
Estimating transfer fees of professional footballers using advanced performance metrics and machine learning,Ian G. McHale & Benjamin Holmes,2023,The study aims to develop a model to predict the transfer fees of professional football players using advanced performance metrics and machine learning techniques. This model seeks to improve the prediction accuracy of transfer fees by incorporating data-driven metrics and sophisticated algorithms.,1946,player,"1,946 player transfers across 36 leagues from the 2011-2020 seasons",Global,"Regression , Ensemble Learning","Linear regression, elastic-net regression, and advanced machine learning models such as XGBoost and extreme gradient boosting with dropout regularization (xgbDART)",Event Data,24,"Age, Age squared, Height, Contract Remaining, On-Loan Status, International Caps in Last 3 Years, minutes played Played, Goals, key pass, Aerial Duels, Tackles Won, Median Purchase Price Club To, Median Purchase Price Club From, Centre Back, Central Defensive Midfielder, Centre Midfielder, Fullback, Side Midfield, Striker, Winger, GIM Performance, xGPM, Overall Rating, Potential Rating, Potential Rating - Overall Rating",Player,Predicted Transfer Fee,Financial Related,Predictive,"[1] Machine learning models (XGBoost and xgbDART) significantly outperform traditional regression in predicting transfer fees, achieving R² values around 0.77. [2] Advanced player metrics (GIM and xGPM) improve prediction accuracy by offering a deeper insight into player contributions beyond traditional metrics like goals because they provid contextual information of the event. [3] The model identifies key variables influencing transfer fees, such as a clubs recent spending history and advanced performance metrics, enabling clubs to identify value-for-money transfers.","[1] The model's reliance on club-specific financial metrics, while useful, may lead to biases that reinforce disparities among clubs with varying budgets. This might limit its applicability for smaller clubs without consistent spending histories. [2] While SoFIFA ratings enhance the model, these crowd-sourced values introduce potential biases, as they may not always reflect real-time player performance accurately."
A novel hybrid method for selecting soccer players during the transfer season,"Mohammad Mahdi Nasiri, Mojtaba Ranjbar, Madjid Tavana, Francisco J. Santos Arteaga & Reza Yazdanparast",2019,"The study presents a multi-criteria decision-making framework integrating fuzzy Analytic Network Process (ANP), PROMETHEE II, and bi-objective mathematical programming to support optimal player selection, accounting for both performance and budget constraints.",60,player,60 players from an Iranian soccer team,Asia,Decision & Heuristic Systems,"The model integrates fuzzy ANP for criteria weighting, PROMETHEE II for player scoring, and bi-objective integer programming for selection optimization, followed by Data Envelopment Analysis (DEA) to refine Pareto-efficient solutions.",Aggregated Data,23,"Passing, ball control, Heading, Free-kick, Finishing, Tackling, Dribbling, Shooting, Moving-without-ball, Crossing, awareness, Team-working, Self-confidence, adaptability, Read-the-game, Creativity, Stamina, Jumping, Speed, Power, Reaction time, Two-footedness, Injury-rate",Player,Overall Player Score,Player Performance Related,Algorithmic rating/composite,"[1] The integrated approach facilitates efficient player selection by balancing performance and financial criteria. [2] The model enables teams to create a balanced roster within budget, while avoiding an overreliance on high-cost star players. [3] The model supports flexible transfer strategies, including loans and permanent acquisitions, tailored to team needs.","[1] The integration of fuzzy ANP and PROMETHEE II with DEA and integer programming is computationally intensive, which may limit its accessibility for real-time decision-making. [2] The need to assign weights for criteria in fuzzy ANP can introduce bias if not carefully managed. [3] The model is designed for transfer season selection, potentially limiting its applicability to long-term team planning or multi-season analysis."
Pitch actions that distinguish high scoring teams: Findings from five European football leagues in 2015-16,Sumit Sarkar & Soumyakanti Chakraborty,2018,"The study aims to identify key pitch actions that significantly impact the scoring ability of teams, focusing on non-penalty goals scored per match. The authors examine various technical and tactical variables to determine what differentiates high-scoring teams across major European leagues.",1826,matches,1826 matches,Europe,Regression,Log-linear regression model is employed to identify impactful variables,Aggregated Data,21,"Shooting accuracy, Short-pass accuracy, long pass accuracy, Cross accuracy, Corner accuracy, Free-kick accuracy, Dribble success, aerial duels won, Shots from outside box, Shots from penalty box,  Shots from goal box, Share of shots from penalty box, Share of shots from goal box, Short passes , long pass, Share long pass, Crosses, Dribbles, Possession %, Corners, Free-kicks",Team and Player,Non-Penalty Goals Scored per game,Action-Centric Performance Metrics,Explanatory (associational/regression),"[1] Shots from the Penalty Box are a primary determinant, with a strong positive correlation to non-penalty goals per game, suggesting close-range shots are most effective for scoring. [2] Long Pass Accuracy positively influences scoring, but an increased share of long passes in total passes shows a negative impact, highlighting the advantage of technical proficiency over frequency. [3] Crosses per Game negatively affect scoring outcomes, which indicates that high-scoring teams may benefit more from central play rather than wide cross-heavy strategies.","[1] The model assumes consistency across leagues without addressing potential league-specific tactical norms or differences in defensive styles, which might influence the effectiveness of specific actions. [2] By aggregating team actions, the model overlooks individual player contributions within specific roles, limiting insights into player-level strategies that could also drive scoring."
Action Valuation of On- and Off-Ball Soccer Players Based on Multi-Agent Deep Reinforcement Learning,"Hiroshi Nakahara, Kazushi Tsutsui, Kazuya Takeda, & Keisuke Fujii",2023,This study proposes a holistic framework for valuing both on-ball and off-ball player actions in soccer using multi-agent deep reinforcement learning (RL). It aims to evaluate how players contribute to both attacking and defensive phases by analyzing their movements and decisions throughout the game.,55,matches,55 Meiji J1 League matches during the 2019 season,Asia,Reinforcement Learning,A deep reinforcement learning model with action supervision is used to compute state-action values (Q-values) for on- and off-ball players. The model mimics Google Footballs action space and leverages supervised learning to estimate Q-values in real-time game scenarios.,Event Data and Tracking Data,21,"x-coordinate, y-coordinate, x velocity, y velocity, Idle action, start sprint, stop sprint, release direction, pass, shoot, Goal, EPV, Concede, move up, move up right, move right, move down right, move down, move down left, move left, move up left",Player,"Q-values, representing the contribution of their actions to the teams success.",Player Performance Related,Algorithmic rating/composite,"[1] The proposed RL model effectively evaluates both on-ball and off-ball contributions, highlighting the importance of indirect actions (e.g., movement without the ball). [2] A moderate negative correlation was found between Q-values and season goals, suggesting that the model values defensive and passing actions more than direct scoring. [3] The model correlates weakly with expert ratings and existing off-ball metrics (e.g., OBSO), emphasizing the unique perspective it provides by valuing actions across all game phases.","[1] The models complexity may limit interpretability, and it struggles with certain counterfactual scenarios (actions not taken by players). [2] The study focuses on attacking phases within the final third, which may overlook defensive contributions and player performance across the full pitch. [3] Limited data (55 games) and a small player sample (14 Yokohama F. Marinos players) could reduce generalizability."
Introducing an expert system for prediction of soccer player ranking using ensemble learning,Reza Maanijou & Seyed Abolghasem Mirroshandel,2019,This study proposes a web-based expert system using ensemble learning to rank soccer players. The system combines various machine learning classifiers optimized by a genetic algorithm to predict player ranks across multiple categories.,495,player,"495 players from the Persian Gulf Premier League, with data collected over the 2015-2016 season",Asia,Ensemble Learning,"Ensemble learning with weighted voting and genetic algorithm optimization, combining classification algorithms like Naive Bayes, SVM, and BayesNet.",Aggregated Data,20,"Age, Appearances in Domestic Leagues, Appearances in International Cups, Appearances in Played Matches, Appearances in National Team, Play Time in International Cups, Play Time in Played Matches, Play Time in National Team, Trophies, Yellow Cards, Trophy Points, Card Points, Goals in Domestic League, Goals in Cups, Goals in National Team, Position, Ranking",Player,Player's Rank,Player Performance Related,Predictive,"[1] The ensemble model showed superior accuracy over individual classifiers, especially when optimized with genetic algorithms. [2] Player rankings produced by the system aligned closely with expert assessments, providing reliable ranking predictions.","[1] The system relies on a regional dataset (Persian Gulf Premier League), limiting its generalizability to other leagues. [2] The genetic algorithm optimization increases computational demands, potentially limiting real-time performance. [3] While ranking is divided into four classes, finer distinctions could enhance player evaluation and scouting applications."
Plus-Minus Player Ratings for Soccer,"Tarak Kharrat, Javier López Peña, & Ian G. McHale",2020,"This study adapts the plus-minus (PM) ratings, commonly used in basketball and ice hockey, for use in soccer. It aims to objectively measure player contributions to team performance by introducing two innovative rating systemsExpected Goals Plus-Minus (xGPM) and Expected Points Plus-Minus (xPPM).",20868,matches,20868 games from 11 European leagues over 8 seasons,Europe,Regression,"Ridge Regression adapted to regularlize adjusted PM model, Expected Goals Model measures player impact on scoring chances and Expected Points Model to measure player impact on match outcomes.",Aggregated Data,20,"Player-presence indicator, home advantage, Man-power Red Card, Man-power Red Card 2, Man-power Red Card 3, Segment length, Exponential time decay weight, Goals, Shots, Substitution, Premier League, Championship, Bundesliga, La Liga, Serie A, Ligue 1, Eredivisie, Primeira Liga, Russian Premier League, Jupiter League",Player,"Plus/Minus Ratings, Expected Goals Plus-Minus, Expected Points Plus-Minus",Player Performance Related,Algorithmic rating/composite,"[1]  xGPM and xPPM provide more nuanced evaluations by considering in-game context, as they consider the location of shots and the impact of the players in certain positions. [2] The PM adaptations allowed for relative strength ranking across European leagues, with the English Premier League emerging as the strongest.","[1] Goalkeepers and frequently substituted players may yield less meaningful PM ratings due to limited data or irregular playtime, which makes it an inaccurate model to judge goalkeepers impact and performance. [2] The model struggles to differentiate players with consistently high performance who always play together, as they do not consider individual performance data to evalaute individual contributions. [3] The method's computational demands may limit its scalability across smaller clubs or leagues with fewer resources."
Factors that Influence Player Market Value in Different Position: Evidence from European Leagues,"Zhangyi Rong, Lujie Wang, Shengting Xie",2024,This study analyzes different playing positions and their relation towards market value,400,player,400 players from UEFA First Tier Leagues,Europe,Regression,"Simple Linear Regression, Multiple Linear Reression, ANOVA Test, T-Test",Aggregated Data,13,"Age, League Rank, Goals, Assists, interceptions, clearances, Save-rate, Height, Appearances, Starts, Local League",Player,Market Value,Financial Related,Explanatory (associational/regression),"[1] younger players have higher market value, age is an important feature in market value. [2] Goalkeepers are exhibit distintive trajectories with their age as it's more consistent as they age, showing that differening positions does impact a player's value.",[1] Scope of dataset only includes European leagues [2] factors are not adqueate [3] no specific positions but only general positions considered
Identifying key players in soccer teams using network analysis and pass difficulty,Ian G. McHale & Samuel D. Relton,2018,"This study uses network analysis combined with a statistical model of pass difficulty to identify key players in soccer teams. The methodology aims to determine pivotal players by assessing the complexity of passes and their impact on team dynamics, supporting decisions in lineup optimization and opponent analysis.",380,matches,380 matches of the 2012-2013 English Premier League season,Europe,"Regression , Graph-Based Modelling",Generalized Additive Mixed Model (GAMM) to evaluate pass difficulty based on contextual factors and integrates network analysis to measure player centrality and connection strength in passing.,Event Data and Tracking Data,17,"Pass distance, Passer to receiver margin-of-errors angle (moe), moe², x-coordinate, y-coordinate, Forward-pass dummy, Difference between opposition and own-team average x-position, home advantage, Number of opponents ? 4 m of passer, Number of opponents within 4 m of intended receiver, Time-on-ball (s), Time-on-ball², Touches count, First-time-pass dummy, Pass number in possession sequence",Player,Pass Success Probability,Action-Centric Performance Metrics,Algorithmic rating/composite,"[1] The network analysis with weighted pass difficulty effectively identified central players who contribute significantly to offensive play. [2] Difficult passes, weighted higher in the analysis, showed which players contribute meaningfully to ball advancement and scoring opportunities.",[1] The number of covariates may limit applicability for real-time decision-making due to computational demands.
A Fuzzy Inference System for Players Evaluation in Multi-Player Sports: The Football Study Case,"Wojciech Sa?abun, Andrii Shekhovtsov, Dragan Pamuc?ar, Jaros?aw Wa?tróbski, Bart?omiej Kizielewicz, Jakub Wie?ckowski, Darko Bozanic?, Karol Urbaniak & Bartosz Nyczaj",2020,"This study introduces a fuzzy inference system based on fuzzy logic and the Characteristic Objects Method (COMET) for evaluating forwards in team sports, using football as a case study. The model aims to objectively assess players based on performance metrics, reducing the subjectivity commonly found in traditional evaluation methods.",37,player,37 players,Europe,Decision & Heuristic Systems,"Fuzzy inference system with COMET for multi-criteria evaluation, using symmetrical and asymmetrical fuzzy triangular numbers to model uncertainty in player attributes.",Aggregated Data,17,"Height, Weight, Age, Total Passes, Pass Accuracy, key pass, Goals, Assists, Total Shots, Shots-on-Target, Bad Control, dispossession, Ball Touches, Dribbles, fouls, fouls won, Offsides",Player,Overall Player Score,Player Performance Related,Algorithmic rating/composite,"[1] The COMET method avoids traditional multi-criteria decision analysis (MCDA) weight assignment, instead using fuzzy logic to handle subjective criteria adaptively. [2] Comparisons with transfer market values and Golden Ball results showed that the model's rankings were competitive with subjective evaluations, suggesting practical relevance.","[1] The model is tailored specifically to forwards, which may limit its applicability to other player roles. [2] The use of fuzzy logic and COMET introduces computational complexity, which may pose challenges for real-time applications."
A Dimension Reduction Approach to Player Rankings in European Football,"Ayse Elvan Aydemir, Tugba Taskaya Temizel, Alptekin Temizel, Kliment Preshlenov, & Daniel M. Strahinov",2021,"This study presents a novel approach to ranking European football players across multiple leagues by developing a framework that standardizes and scales player performance metrics. This dimension reduction technique helps compare players across different competitions and considers external factors such as opponent difficulty, competition quality, and recency.",150810,player,"150,810 player-match observations",Europe,Unsupervised Learning,"The study scales in-game statistics to account for game duration using a modified per-90 minute scaling that standardizes player metrics across games, competition quality, opponent strength, and game recency. KPCA with cosine similarity for final dimension reduction to represent overall player performance in a single ranking metric.",Aggregated Data,15,"passes attempted, accurate passes, key pass, crosses, shots, dribbles, offensive duels won, defensive duels won, interceptions, recoveries, clearances, fouls committed, aerial duels won, ELO-based game-difficulty scale, competition-quality multiplier",Player,Player Ranking via Dimension Reduction,Player Performance Related,Algorithmic rating/composite,"[1] High-ranked players correlate significantly with increased market values and transfers to higher-ranking teams. [2] The scaling and KPCA approaches enable fair comparison of players across leagues, providing a global view of player performance. [3] The rank groups correlated well with post-analysis player market values, showing the frameworks effectiveness in estimating value increases beyond inflation.","[1] Middle-ranked players showed less market value differentiation, suggesting potential limitations in capturing mid-level performance factors. Only high-ranked players capture the value of the model. [2] The studys validation relies on market values from Transfermarkt, which may not fully reflect all aspects of player quality. [3] The model focuses on left and right backs, limiting generalizability to other positions without further adjustments."
