Article Title,Author(s),Year,Purpose,Sample Size,Category,Sample,Geographical Representation,Modelling Approach,Techniques/Model Used,Type of Data,Factors,Type of Rating,Evaluation Metric/Rating System,Evaluation Category,Key Findings,Criticism/Limitation
What are the key performance indicators for a top position in the German Bundesliga?: 2022-2023 Bundesliga season example,Gizem Baskaya,2023,"Compare performance of teams using technical, tactical and physical performance parameters according to league rankings, reveal its effect and relationship",612,matches,612 matches played in Bundesliga,Europe,Regression,MANOVA test to reveal the difference between the teams and effect sizes were reported. Pearson Correlation Test was applied to determine the relationships between the performance parameters of the teams and the points they collected,Aggregated Data,"possession, percentage of accurate passes, goals scored, goals conceded, total shots, total duels won, total aerial duels won, total points, running distance per match, total running distance, high intensity running, number of sprints",Team and Player,League ranking,Team Performance Related,"[1] Goals scored, goals conceded, total shots and total points are in favor of top ranked teams. [2] Possession, pass accuracy, goals scored, total shots (+) & goals conceded and aerial duels won (-) are highly correlated. [3] Running parameters have no correlation with points.","[1] Goalkeeping parameters are not considered. [2] Ignored the play without the ball in terms of their physical performance, and could not be reported on the data site. [3] No context in playing position is considered."
Action Valuation of On- and Off-Ball Soccer Players Based on Multi-Agent Deep Reinforcement Learning,"Hiroshi Nakahara, Kazushi Tsutsui, Kazuya Takeda, & Keisuke Fujii",2023,This study proposes a holistic framework for valuing both on-ball and off-ball player actions in soccer using multi-agent deep reinforcement learning (RL). It aims to evaluate how players contribute to both attacking and defensive phases by analyzing their movements and decisions throughout the game.,55,matches,55 Meiji J1 League matches during the 2019 season,Asia,Reinforcement Learning,A deep reinforcement learning model with action supervision is used to compute state-action values (Q-values) for on- and off-ball players. The model mimics Google Football’s action space and leverages supervised learning to estimate Q-values in real-time game scenarios.,Event Data and Tracking Data,"xy coordinates, actions, goals, ratings",Player,"Q-values, representing the contribution of their actions to the team’s success.",Player Performance Related,"[1] The proposed RL model effectively evaluates both on-ball and off-ball contributions, highlighting the importance of indirect actions (e.g., movement without the ball). [2] A moderate negative correlation was found between Q-values and season goals, suggesting that the model values defensive and passing actions more than direct scoring. [3] The model correlates weakly with expert ratings and existing off-ball metrics (e.g., OBSO), emphasizing the unique perspective it provides by valuing actions across all game phases.","[1] The model’s complexity may limit interpretability, and it struggles with certain counterfactual scenarios (actions not taken by players). [2] The study focuses on attacking phases within the final third, which may overlook defensive contributions and player performance across the full pitch. [3] Limited data (55 games) and a small player sample (14 Yokohama F. Marinos players) could reduce generalizability."
Influence of Game Indicators on the Ranking of Teams in the Spanish Soccer League,"José Fernández-Cortés, Juan M. García-Ceberino, Javier García-Rubio & Sergio J. Ibáñez",2023,"This study analyzes the impact of various game indicators on the partial and final rankings of Spanish LaLiga teams across three distinct periods (pre-COVID-19, during COVID-19, and post-COVID-19). It aims to identify which indicators most strongly correlate with successful league outcomes.",2660,matches,"2,660 LaLiga matches across seven seasons",Europe,Regression,one-factor ANOVA and linear mixed models to evaluate the effects of game indicators on team rankings,Aggregated Data,"ball possession, total passes, shots on goal, shots off goal, yellow cards, and fouls, among others.",Team and Player,Team Rankings,Team Performance Related,"[1] Ball Possession and Total Passes Influence Final Ranking as higher-ranked teams consistently showed greater ball possession and a higher number of total passes, especially those qualifying for European competition. Shows that players who make more passes hold greater value in the team. [2] The COVID-19 period saw reduced home advantage, affecting match outcomes and related game indicators like fouls and yellow cards. This comes to speculate that referees are often dictated by the emotions of the crowd when awarding fouls or providing advantageous decisions to the home side.","[1] This analysis is limited to LaLiga, which may not generalize to leagues with different tactical and stylistic norms. [2] No contextualized information on the statistical data. [3] By focusing on pandemic periods, the study’s insights might not fully apply to long-term trends, as the COVID-19 period had unique situational factors."
Evaluation of Goalkeepers’ Performance via Grey Relational Analysis Method: Example of Africa Cup of Nations,Abdullah Yi?it Güngör,2024,"This study applies the Grey Relational Analysis (GRA) method to evaluate and rank goalkeeper performances in the 2023 Africa Cup of Nations (AFCON). It aims to identify top performers by quantifying defensive and distributional metrics to assist stakeholders, including scouts and coaches, in making objective performance evaluations.",52,matches,52 matches,Africa,Decision & Heuristic Systems,"Grey Relational Analysis (GRA) model ranks goalkeepers based on save percentage, claimed crosses, and passing accuracy.",Aggregated Data,"Save percentage, claimed crosses, passing accuracy per match, market value",Player,GRA-based performance scores,Player Performance Related,"[1] High-performing goalkeepers were not always from the highest-valued teams, suggesting that market value is not the sole indicator of success. [2] GRA offers a structured approach to goalkeeper ratings, allowing weighted scoring across different skill areas (saves, distribution, aerial play).","[1] Only three metrics (save percentage, claimed crosses, passing accuracy) were analyzed, potentially overlooking other critical factors like positioning and reflexes. [2] GRA assumes equal importance across metrics, which may not fully represent the diverse skill set required for goalkeeping."
Diverse Machine Learning for Forecasting Goal-Scoring Likelihood in Elite Football Leagues,"Christina Markopoulou, George Papageorgiou & Christos Tjortjis",2024,"The study aims to forecast goal-scoring likelihood among players across four major European leagues using advanced machine learning techniques. It evaluates the predictive accuracy of several machine learning models for player goal predictions. By forecasting goal-scoring likelihood, the model provides an objective, data-driven basis for evaluating strikers and offensive players’ contributions.",424,player,424 players across four leagues,Europe,Supervised Learning,"XGBoost, gradient boosting, random forest, ridge regression, linear regression, and multilayer perceptron (MLP)",Aggregated Data,"expected goals (xG), previous goals, expected assists, goals per 90 minutes, player position, and several advanced metrics tailored for each model.",Player,Goal-Scoring Likelihood,Player Performance Related,"[1] XGBoost consistently outperforms other models in most datasets, showing strong predictive accuracy, particularly in Serie A with an MAE of 1.29. [2] Expected Goals (xG) and previous goals are critical features as they provide added context into the actions that take place.","[1] The model heavily depends on historical scoring data, which might limit its predictive power for new players or those returning from injuries. [2]  The ensemble and neural models, while accurate, may lack transparency, making it challenging for clubs to understand the factors influencing predictions. [3] The study’s focus on top-scoring players might introduce selection bias, as lower-scoring players or defenders are less represented in goal-scoring prediction models."
Factors that Influence Player Market Value in Different Position: Evidence from European Leagues,"Zhangyi Rong, Lujie Wang, Shengting Xie",2024,This study analyzes different playing positions and their relation towards market value,400,player,400 players from UEFA First Tier Leagues,Europe,Regression,"Simple Linear Regression, Multiple Linear Reression, ANOVA Test, T-Test",Aggregated Data,"age, nationality, league affiliation, height, weight, goals, assists, starts, clearances, injuries, save rate, interception",Player,Market Value,Financial Related,"[1] younger players have higher market value, age is an important feature in market value. [2] Goalkeepers are exhibit distintive trajectories with their age as it's more consistent as they age, showing that differening positions does impact a player's value.",[1] Scope of dataset only includes European leagues [2] factors are not adqueate [3] no specific positions but only general positions considered
The Betting Odds Rating System: Using soccer forecasts to forecast soccer,Fabian Wunderlich & Daniel Memmert,2018,Using betting odds of single matches to draw conclusions about quality of teams,14931,matches,"14,931 matches",Global,"Custom Rating Systems , Regression","ELO calculations implemented, replacing actual result with expected results in terms of betting odds.",Aggregated Data,"match date, home team, away team, home goals, away goals, betting odds for home win, betting odds for draw, betting odds for away win",Team and Player,ELO-Odds (Betting Odds based ELO Team Ratings),Team Performance Related,"[1] Outperform traditional ELO models (ELO-Goals & ELO-Results), showing that betting odds prior to matches contain more relevant information and more valuable insights to performance analysis than the result of the match itself.","[1] Using intangible home and away factors undermines the quality of team performance in the general state of play, where they are judged on equal grounds. [2] Ratings constructed prior to the match as a measure for the actual result, ignoring the performance that is observable during or after the match which would cause inconclusive result of the player/team performance in the given game. [3] It can only extract team specific information from the betting odds and aggregate them in the ratings, but exclude relevant information such as injuries or line ups."
Team Composition in PES2018 Using Submodular Function Optimization,"Yifeng Zeng, Gaoyang Shen, Bilian Chen & Jing Tang",2019,This study explores an automated team composition method in Pro Evolution Soccer 2018 (PES2018) by framing team selection as a submodular optimization problem. The goal is to recommend an optimal team that maximizes skill coverage and meets budget constraints.,9563,player,"9,563 players from the PES2018 database",Global,Optimization Techniques,"Submodular function optimization techniques, applying a greedy algorithm and an improved Cost-Effective Forward selection Greedy (CEFG) algorithm to optimize team selection.",Aggregated Data,"attacking prowess, ball control, dribbling, passing, and speed to maximize skill coverage",Player,Team's Win Rate,Team Performance Related,"[1] The Elo-based system identified key players whose ratings contributed significantly to team success. [2] Player-based ratings outperformed team-only ratings in match outcome predictions, supporting the system’s use for evaluating lineup strength. [3] The rating system proved adaptable across competitions and was effective for player ranking, suggesting usefulness for scouting purposes in identifying high-impact players.","[1] Using PES2018 data limits generalizability, as attributes and skills may not reflect real-world player dynamics. [2] The study estimates player salaries based on ratings, which may not accurately capture true player value in complex sports markets. [3] By constraining team composition to a single formation, the model may lack flexibility in adapting to varied game strategies."
Machine Learning Models Reveal Key Performance Metrics of Football Players to Win Matches in Qatar Stars League,Jassim Almulla & Tanvir Alam,2020,The study aims to develop machine learning models to identify key performance metrics that contribute to winning football matches in the Qatar Stars League (QSL). It seeks to use these metrics to create a classification model that can predict whether a team will win or lose a match based on player performance.,1121,matches,"1,121 matches",Asia,Supervised Learning,Classification framework in the machine learning context,Aggregated Data,"player data, match data, technical performance, physical performance",Player,Key Performance Metrics,Team Performance Related,"[1] Shots on Target by Forwarders is the most significant metric, Successful Passes, High-Speed Distance, Defenders' Role, Fair Play are determinants of winning. [2] The Logistic Regression (LR) model was the best performing, achieving over 80% accuracy in predicting match outcomes.","[1] The study excludes draw matches from the analysis, focusing solely on wins and losses, the model may be oversimplifying the dynamics of football matches and missing out on a third, often crucial, outcome. [2] No contextualized information on the statistical data. [3] The data used is specific to the Qatar Stars League (QSL), which might not be as comprehensive as data from higher-profile leagues, the model may not be robust enough to apply to other leagues or future seasons without retraining. "
Developing a Reliable Hybrid Machine Learning Model for Objective Soccer Player Valuation,Hongtao Yu & Jialiang Li,2024,"This study proposes a hybrid machine learning model to improve the accuracy and reliability of soccer player market value predictions. The model seeks to provide an objective, data-driven approach for estimating player values, addressing limitations in traditional methods based on expert opinion or basic statistical models.",491,player,491 players from FIFA 20 video game,Global,Regression,"Decision Tree Regression (DTR) enhanced with two metaheuristic algorithms: the Jellyfish Search Optimizer (JSO) and the Honey Badger Algorithm (HBA), creating two hybrid models, DTJS (Decision Tree + JSO) and DTHB (Decision Tree + HBA)",Aggregated Data,"age, ball control, interceptions, reactions, and agility, among other technical and physical attributes, which are used to predict market values.",Player,Predicted Market Value,Financial Related,"[1] The DTJS (Decision Tree and Jellyfish Search Optimizer) hybrid model achieves an R² value of 0.982, outperforming other baseline models and providing highly accurate market value predictions, showing faster convergence and lower prediction errors. [2] Age, ball control, and interceptions are identified as the most significant predictors of market value, providing actionable insights for performance-focused player evaluations.","[1] While FIFA data is accessible, it may not capture real-world complexities, potentially limiting the model’s relevance for actual player valuations. [2] The study lacks validation against actual transfer fees, so the model’s accuracy in real market scenarios remains unverified."
Analysis of the Smart Player’s Impact on the Success of a Team Empowered with Machine Learning,"Muhammad Adnan Khan, Mubashar Habib, Shazia Saqib, Tahir Alyas, Khalid Masood Khan, Mohammed A. Al Ghamdi & Sultan H. Almotiri",2020,"The study seeks to quantify the impact of a ""smart player"" (Lionel Messi, in this case) on a team's success by developing a predictive model using machine learning. The model assesses the dependency of team outcomes on the performance of a star player, aiming to demonstrate the significance of player leadership and skill.",927,matches,927 Barcelona games from 2005 to 2020.,Europe,Neural Network,"Adaptive Back Propagation Neural Network (ABPNN) for performance prediction, with training conducted on historical match data",Aggregated Data,"goals, results",Team and Player,Team Success ,Team Performance Related,"[1] The ABPNN model achieved 94% accuracy, successfully predicting outcomes based on player dependency categories. [2] Barcelona’s success in over 28% of games was significantly attributed to Messi’s presence, indicating a substantial impact of a star player on team outcomes and the importance towards player evalaution to understand its impact on the overall picture. [3] By quantitatively linking player contributions to team performance, this study underscores the value of high-impact players and supports evidence-based decisions for contract extensions and strategic lineup choices.",[1] Using only Messi’s data limits the model’s application to evaluating broader team dynamics or other players’ impact on performance.
Using composite performance variables to explain football players’ market values,Christer Thrane,2024,The present study examines how Fotmob's composite performance index (ratings) is associated with football players’ market values as defined by the Norwegian website FotMob and by the German website Transfermarkt.,240,matches,240 Eliteserien matches,Europe,Regression,Regression analysis to find relationship between FotMob ratings and market values neet of the independent variables typically used in previous regression models,Aggregated Data,"Fotmob rating, market value, goals, assists, cards, footedness, national team status, matches in career, age, position, nationality, year of contract signing, year of contract termination, number of matches in European cups, number of wins, number of previous clubs",Player,Transfermrkt Market Value & Fotmob performance index,Financial Related,"[1] Fotmob performance index contributed with unique explanatory power regarding market values. [2] Fotmob performance index also contigent on player's age (younger), player positions (midfielder/striker), and players with longer contract durations. [3] Certain independent variables effects on market value is exaggerated when not adjusted for the composite performance index. [4] Fotmob performance index has ample explanatory power when predicting ratings for players when tested against subjective ratings from reporters.",[1] No contextualized information on the statistical data. [2] Potential issues with multicolinearity due to large usage of independent variables. [3] Small dataset may not provide enough predicitve power to analysis.
On the use of passing network indicators to predict football outcomes,"Riccardo Ievoli, Lucio Palazzo & Giancarlo Ragozini",2021,"This study investigates the predictive value of network-based metrics derived from passing networks in determining match outcomes. It seeks to assess whether these metrics can enhance predictive models for winning probabilities, using both network indicators and traditional match variables.",96,matches,"96 matches from the 2016-2017 UEFA Champions League Group Stage, involving 32 top European teams",Europe,Graph-Based Modelling,"Binomial Logistic Regression (BLR) and compares it with machine learning models like Artificial Neural Networks (ANN), Naive Bayes (NB), and Random Forest (RF)",Event Data,"network diameter, centralization, clustering, and average neighborhood size, alongside control variables like attempts, fouls, ball possession, and distance covered",Team and Player,Player Network Centrality,Team Performance Related,"[1] The inclusion of network-based indicators enhances model accuracy, with BLR achieving higher AUC and accuracy than models without network data, showing that contextual element of a player's passing adds value to the accuracy of the model. [2] Betweenness centralization and network diameter significantly contribute to predicting a team’s probability of winning, and thus gauging a player's role in creating connectivity, highlighting influential players in passing networks. [3] Among the tested models, BLR performs well with a balance between sensitivity and specificity, suggesting it is a reliable approach for win prediction.","[1] The study focuses solely on passing networks without considering positional or spatial data, which could provide critical context on how passes and formations impact outcomes. [2] The model is developed using data from high-profile UEFA Champions League teams, which may limit applicability to teams with different playing styles or less structured passing dynamics."
Machine Learning-Based Identification of the Strongest Predictive Variables of Winning and Losing in Belgian Professional Soccer,"Youri Geurkink, Jan Boone, Steven Verstockt, & Jan G. Bourgois",2021,"This study aims to identify the strongest predictive variables of winning and losing in the highest Belgian soccer division using machine learning techniques. It analyzes a wide range of variables, including technical, tactical, physical, and contextual indicators, to determine which factors most strongly correlate with match outcomes.",576,matches,"576 matches from Belgian's highest division, covering 2017/18 - 2019/20 seasons",Europe,"Ensemble Learning , Supervised Learning","xGBoost applied to predict outcome, after VIF to obtain relevant variables and BorutaShap for feature selection. TreeExplainer was used to identify the importance of features both globally and locally through SHAP values.",Aggregated Data,"shot-related, defense, technical, physical, disciplinal, set pieces, contextual",Player,Key Predictors to Winning,Team Performance Related,"[1] Strongest predictor of winning or losing was the total number of shots on target from inside the attacking penalty box, showing the relevance of contextualizing variables for inside the box where dangerous attacks can be scored or denied from. Other metrics include possession won and crosses. [2] Physical performance indicators are predictive only in the second half of games. [3] Not all traditional variables are strong predictors, need to be assessed. ","[1] Reliance on physical metrics in the second half overlook contributions in the first half, while it showed that the team who have greater energy span across the game are more successful, it is difficult to capture this particular attribute as momentum plays apart. [2] The study only considers win/loss outcomes, excluding draws from the analysis, which could limit understanding of full match dynamics. [3] The model does not fully distinguish between variables that are causes of performance (e.g., physical output) and variables that are effects (e.g., increased high-intensity efforts when losing)."
Discovering associations between players’ performance indicators and matches’ results in the European Soccer Leagues,Maurizio Carpita & Silvia Golia,2021,"Using Bayesian Network to mine the relations between players' performance indicators of 4 different roles and the results of matches, and to predict the wins of the home team.",18873,matches,"18,873 matches",Europe,Bayesian Methods,Bayesian Network,Aggregated Data,"match, date, positions, home goals, away goals, power, mentality, skill, movement, attacking, goalkeeping, ELO",Player,Overall performance indicator (predictor to result of match),Team Performance Related,"[1] Midfielders are important to obtaining a winning result for the home team, while defenders are more important to the away team. [2] Bayesian Network built with OPI has the same predictive power as Bayesian Network built with ELO but BN with OPI describes the dependence/independence relationships amongst variable","[1] Model doesn't incorporate contextual information, in the ratings. [2] No description on OPI's calculcations. [3] OPI generated from scouted perspectives which may be derived without statistical basis."
