Article Title,Author(s),Year,Purpose,Sample Size,Category,Sample,Geographical Representation,Modelling Approach,Techniques/Model Used,Type of Data,Factors,Type of Rating,Evaluation Metric/Rating System,Evaluation Category,Key Findings,Criticism/Limitation
Outcome bias in subjective ratings of performance: Evidence from the (football) field,"Edgar E. Kausel, Santiago Ventura, & Arturo Rodriguez",2018,Studying the independence between performance and outcome to study outcome bias in football players' subjective performance ratings,43,matches,43 games,Global,Regression,multilevel mixed-effects and fixed-effects modeling,Aggregated Data,"performance ratings, penalty shootout result (won/lost), ",Player,Subjective performance rating from goal.com,Player Performance Related,"[1] Players who won the penalty shootout received a higher rating, proving that winning by penalties did have an effect on reporters' performance ratings of footballers. [2] This could lessen the argument for subjective ratings as it's also consistent with extensive literature on biases in performance ratings, as they put unwarranted weight on the outcome.","[1] Goal.com reporters gives holistic ratings and not criteria/metric based structure to footballers, as such they lack coherent foundations from the start. [2] The study could make better judgement with a formula to judge players on, having separate judehemtns on specific performance dimensions (shooting, passing, etc.)."
Data-driven exploratory approach on player valuation in football transfer market,"Yunhu Kim, Khac-Hoai Nam Bui, & Jason J. Jung",2019,"The paper proposes a data-driven approach for classifying football players based on performance and transfer fee, aiming to improve the objectivity and reliability of player valuation in the transfer market. The study focuses on using player performance data to predict post-transfer performance and classify players into value categories.",N/A,N/A,"Not specified, historical data from Whoscored and BBC of players who made transfers",Global,"Regression , Supervised Learning , Unsupervised Learning","Regression analysis to predict player performances after trasnfer. Boruta Algorithm for feature selection to identify important attributes of each position, K-Means Clusterting to classify players into 4 catgoeries based on performance and transfer fee.",Aggregated Data,"assists, goals, dribbles, key passes, pass success rate, and transfer fee",Player,Categorized into 4 clusters: LPLF: Low performance and low transfer fee. LPHF: Low performance and high transfer fee. HPHF: High performance and high transfer fee. HPLF: High performance and low transfer fee.,Financial Related,"[1] The Boruta algorithm was effective in identifying important performance attributes like assists, dribbles, and key passes for different positions. [2] Clustering results reveal that transfer fees are not always aligned with player performance, as some high-fee players underperform post-transfer, while lower-fee players overperform, which suggests transfer fees are often impacted by different factors that are not considered in the study (club finances). [3] Passing performances and dribbling are critical in the evaluation of players in most position according to the  Boruta algorithm, which shows that a player's technical ability is high regarded in their value.",[1] No contextualized information on the statistical data. [2] Transfer fee is not suitable as a variable due to the intangible factors like club finances not being included in the study. Regression analysis done on the transfer fee of the player misleads the true quality and performance of the player.
Estimation of Market Values of Football Players through Artificial Neural Network: A Model Study from the Turkish Super League,Tugbay Inan & Levent Cavas,2021,"The study develops an Artificial Neural Network (ANN) model to estimate the market values of Turkish Super League (TSL) players using performance-based parameters, with the goal of offering an objective valuation approach based solely on performance metrics.",236,player,236 midfield players from the Turkish Super League,Europe,Neural Network,Artificial Neural Network (ANN) with optimization of hidden layers and backpropagation algorithms.,Aggregated Data,"Minutes played, goals, expected goals (xG), assists, expected assists (xA), defensive duels won, tackle success, shot accuracy, short/mid pass accuracy, long pass accuracy, passes to penalty area",Player,Predicted Market Value,Financial Related,"[1] ANN was able to predict market values efficiently when simulated data was used, but not with real data from OPTA, showing how difficult it is to evalaute players based on market value using real performance data as Market value considers different aspects outside the pitch. [2] Metrics like minutes played, pass accuracy, and shots on target were influential in determining market values, highlighting the importance of consistent play and skill.","[1] Lack of correlation with real-world data indicates limitations in using only performance metrics to predict market value. [2] Simulated data may not reflect real-world complexities, limiting model applicability in actual transfer valuations. [3] No contextualized information on the statistical data."
Performance and Actual Pay in Norwegian Soccer,Christer Thrane,2019,"This study examines the relationship between player performance and pay in Norwegian soccer, specifically within Eliteserien, Norway's top league. It aims to determine whether market values can be a reliable proxy for actual earnings in performance-pay studies.",240,player,"240 players from the 2014 season of Eliteserien, Norway’s premier soccer league",Europe,Regression,Ordinary Least Squares (OLS) regressions to compare market value-based estimates with actual earnings.,Aggregated Data,"mean match ratings from journalists, national team appearances, club appearances, minutes played",Player,Player Earnings and Market Value,Financial Related,"[1] The study demonstrates that player longevity and consistent performance (e.g., club appearances, national team caps) contribute significantly to actual pay, highlighting the value of rating systems that account for sustained career achievement. [2] Market values might misrepresent a player’s consistent contributions and overrate single-season impacts, suggesting that actual salary-based ratings could yield more reliable long-term evaluations.","[1] Eliteserien's distinct financial environment may not generalize to larger leagues. [2] The study relies primarily on ratings and basic performance metrics, lacking deeper game metrics like assists or defensive actions. [3] Lagged performance and earnings data potentially overlook more immediate impacts of performance on pay."
Uncovering Value Drivers of High Performance Soccer Players,"Maribel Serna Rodríguez, Andrés Ramírez Hassan & Alexander Coad",2019,"This study aims to identify key factors driving the market value of high-performance soccer players in Europe's top leagues. Using Bayesian Model Averaging (BMA) to account for model uncertainty, the research uncovers critical value drivers among numerous potential factors, distinguishing value-enhancing from value-diminishing attributes.",335,player,335 players from the five major European leagues across 2015-2020,Europe,Bayesian Methods,"Bayesian Model Averaging (BMA) utilized to address model uncertainty by generating a weighted average across multiple model specifications .Instrumental Variable Bayesian Model Averaging (IVBMA) addresses endogeneity in player market value and performance measures, enhancing reliability.",Aggregated Data,"appearance, age, national team appearances, goals",Player,Market Value ratings,Financial Related,"[1] Player appearances, national team participation, age and goal scored drive market value. [2] BMA and IVBMA help discern truly significant factors by adjusting for model uncertainty and endogeneity.","[1] Lacks longitudinal insights; therefore, it doesn’t capture year-over-year changes in individual player performance or market trends. [2] High computational demands make this approach challenging to apply in real-time contexts or as a regularly updated model. [3] BMA assumes static relationships within models, which may overlook evolving market trends or league-specific factors."
Determinants of Transfers Fees: Evidence from the Five Major European Football Leagues,Lennart Ante,2019,"This study investigates the determinants of transfer fees in football by analyzing various player and club characteristics that impact market value, covering transfers in the five major European leagues during the 2018/19 season. It explores how demographics, performance, social media popularity, and other external factors influence transfer fees across sub-groups of players.",389,player,389 transfers from the 2018/19 summer window in the top five European leagues,Europe,Regression,"Stepwise Regression with Backward Elimination analyzes the influence of multiple variables on transfer fees, removing non-significant factors iteratively, while Variance Inflation Factor is used to ensure minimal multicolinearity in regression models.",Aggregated Data,"transfer data, social media metrics, demographics",Player,Predicted Transfer Fee,Financial Related,"[1] Goals and social media presence positively impact transfer fees, with social media particularly relevant in Ligue 1, however popularity does not dictate performance levels. [2] Transfer determinants vary by league and position, with age and playing time more predictive in some leagues and for forwards. [3] Players from Europe and South America, especially forwards and offensive midfielders, tend to command higher transfer fees, showing the popularity in European football and why many literature is based on European football.","[1] Reliance on public databases may exclude unreported transfer fees or hidden variables like agent fees. [2] Popularity and fame are not indicative measures of a player's performance levels, which suggests that transfer valiue of players cannot be relied on. [3] No contextualized information on the statistical data."
Scientific evaluation of the transfer value of football players,"Raffaele Poli, Loïc Ravenel, & Roger Besson",2020,"The study aims to develop a robust, statistical model to estimate the transfer market values of football players using objective data, which allows for a scientific approach to determining these values and helps clubs make more informed financial and strategic decisions.",1790,player,"1,790 paid transfers involving players in the top five European leagues between 2012 to 2020",Europe,Regression,"Regression models to incorporate both sporting and financial variables. Regularization techniques were used to address financial variances and improve model stability, accounting for various club-related factors like financial strength.",Aggregated Data,"contract duration, player age, international status, career progression, league reputation, transfer seasons, club financial capacity",Player,Transfer Value,Financial Related,"[1] Model explained over 80% of the varience in actual trasfer fees, indicating a strong alignment with real-world market valuations. [2] Analysis showed that club financial power (wealthier clubs) significantly impacts transfer values, with wealthier clubs often paying higher fees for players, which suggest that player's own transfer value is heavily dictated by factors outside the player's control. ","[1] External factors such as club's need for liquidity, internal player conflicts can cause discrepancies between estimated values and actual market price. [2] No contextualized information on the statistical data. [3] The model may be less effective outside of the top five European leagues due to differing economic conditions, competition levels, and market dynamics across various global leagues."
How Soccer Players’ Box Score Statistics Effect on their Rating and Market Value,Haoyang Yan,2020,"This study explores how box score statistics influence players’ ratings and market values. By introducing a new statistic, Box Rating (BR), the research seeks to quantify player performance based on 26 game metrics and use statistical models to assess the relationship between these metrics, player ratings, and market valuations.",2024,player,"2,024 players from Europe’s top five leagues (Premier League, La Liga, Serie A, Bundesliga, Ligue 1) over three seasons (2017-2020)",Europe,Regression,Multiple Linear Regression used to derive the Box Rating (BR) by regressing 26 box score variables against player ratings.,Aggregated Data,"box score statistics, market value data, FIFA20 ability ratings",Player,Box Rating and Predicted Market Value,Financial Related,"[1] Goals and assists were the most impactful on BR and ratings, while negative actions (e.g., fouls, yellow cards) diminished ratings. [2] BR showed a strong correlation (0.89 R²) with player ratings from WhoScored, validating it as a robust performance metric. [3] Market value correlates not only with BR but also with player age and popularity, indicating that external factors significantly affect valuations.","[1] Goalkeepers showed less correlation with BR due to fewer box score metrics applicable to their role, complicating their valuation. [2] Using Transfermarkt values and FIFA20 ratings may introduce bias from subjective or video game-based evaluations. [3] No contextualized information on the statistical data."
Predicting Market Value of Football Players Using Machine Learning Algorithms,Sidharrth Mahadevan,2020,"This study aims to address the challenge of estimating football players' market value accurately, focusing on machine learning as a data-driven alternative to crowdsourced methods like Transfermarkt.",4250,player,"4,250 players across 150 European teams, covering a five-season span (2010/11–2015/16)",Europe,Regression,"Ordinary Least Squares (OLS) regression was used, alongside variables selected through data mining and feature engineering.",Aggregated Data,"Goals, minutes played, bookings, dribbles, passes, tackles, aerial duels per game, Google Trends, Wikipedia views, Reddit score, YouTube views, Height, age, nationality, footedness, position",Player,Market Value,Financial Related,"[1] The model closely aligns with Transfermarkt values, especially for low- to mid-market players, achieving around 85% accuracy. [2] Objective indicators outperform crowd judgments, providing a reproducible and transparent approach to valuation.","[1] Model shows difficulty accurately predicting values of top-tier players due to the intangible factors. [2] The model lacks granular performance data, which large organizations use to capture extensive metrics per player per game. [3] Transfermarkt’s subjective inputs introduce potential bias, as crowd valuations favor players with high public appeal."
On the relationship between +/– ratings and event-level performance statistics,Garry A. Gelade & Lars Magnus Hvattum,2020,"This study investigates the relationship between event-level performance statistics (e.g., passes, interceptions) and the Plus-Minus (PM) rating system, a player rating methodology widely used in sports analytics. The paper examines the effectiveness of integrating specific player events to improve the predictive power and reliability of PM ratings for football.",16430,matches,"16,430 matches across five top European leagues",Europe,Regression,Multiple Linear Regression analyzes event-based data to assess variance in PM ratings. Recursive Feature Elimination to refine predictor variables for each position-specific PM model.,Event Data,"key passes, assists, tackle, save, aerial duels, red cards",Player,Enhanced Plus/Minus Ratings,Player Performance Related,"[1] Event-level statistics explain 22%-38% of variance in PM ratings, suggesting moderate alignment between top-down (PM) and bottom-up (event-based) metrics. [2] Event factors like key passes and interceptions strongly influence ratings for forwards and defensive midfielders, while goalkeepers rely heavily on saves and pass completion. [3] Combining event-based data with PM ratings improves match outcome predictions slightly but highlights PM ratings’ limitations as player-specific performance measures.","[1] PM ratings often incorporate both a player's direct contributions and contextual factors like team dynamics, which can dilute or misrepresent an individual player’s true performance. [2] The PM model favors forwards and attacking players, as these roles more directly affect score differentials. [3]  PM ratings for players with limited playtime or inconsistent performance can be highly variable, potentially affecting reliability in less predictable positions."
Plus-Minus Player Ratings for Soccer,"Tarak Kharrat, Javier López Peña, & Ian G. McHale",2020,"This study adapts the plus-minus (PM) ratings, commonly used in basketball and ice hockey, for use in soccer. It aims to objectively measure player contributions to team performance by introducing two innovative rating systems—Expected Goals Plus-Minus (xGPM) and Expected Points Plus-Minus (xPPM).",20868,matches,20868 games from 11 European leagues over 8 seasons,Europe,Regression,"Ridge Regression adapted to regularlize adjusted PM model, Expected Goals Model measures player impact on scoring chances and Expected Points Model to measure player impact on match outcomes.",Aggregated Data,"Goals, shots, game duration, substitutions, red cards, Player starting line-ups, segment performance, team dynamics, Team and league attributes, time-weighting for recent performance, and home-field advantage adjustments",Player,"Plus/Minus Ratings, Expected Goals Plus-Minus, Expected Points Plus-Minus",Player Performance Related,"[1]  xGPM and xPPM provide more nuanced evaluations by considering in-game context, as they consider the location of shots and the impact of the players in certain positions. [2] The PM adaptations allowed for relative strength ranking across European leagues, with the English Premier League emerging as the strongest.","[1] Goalkeepers and frequently substituted players may yield less meaningful PM ratings due to limited data or irregular playtime, which makes it an inaccurate model to judge goalkeepers impact and performance. [2] The model struggles to differentiate players with consistently high performance who always play together, as they do not consider individual performance data to evalaute individual contributions. [3] The method's computational demands may limit its scalability across smaller clubs or leagues with fewer resources."
Estimating transfer fees of professional footballers using advanced performance metrics and machine learning,Ian G. McHale & Benjamin Holmes,2023,The study aims to develop a model to predict the transfer fees of professional football players using advanced performance metrics and machine learning techniques. This model seeks to improve the prediction accuracy of transfer fees by incorporating data-driven metrics and sophisticated algorithms.,1946,player,"1,946 player transfers across 36 leagues from the 2011-2020 seasons",Global,"Regression , Ensemble Learning","Linear regression, elastic-net regression, and advanced machine learning models such as XGBoost and extreme gradient boosting with dropout regularization (xgbDART)",Event Data,"Player characteristics (age, height), experience (minutes played, international appearances), contract status, and performance metrics (Goals Impact Metric (GIM), Expected Goals Plus-Minus (xGPM), and crowd-sourced SoFIFA ratings)",Player,Predicted Transfer Fee,Financial Related,"[1] Machine learning models (XGBoost and xgbDART) significantly outperform traditional regression in predicting transfer fees, achieving R² values around 0.77. [2] Advanced player metrics (GIM and xGPM) improve prediction accuracy by offering a deeper insight into player contributions beyond traditional metrics like goals because they provid contextual information of the event. [3] The model identifies key variables influencing transfer fees, such as a club’s recent spending history and advanced performance metrics, enabling clubs to identify value-for-money transfers.","[1] The model's reliance on club-specific financial metrics, while useful, may lead to biases that reinforce disparities among clubs with varying budgets. This might limit its applicability for smaller clubs without consistent spending histories. [2] While SoFIFA ratings enhance the model, these crowd-sourced values introduce potential biases, as they may not always reflect real-time player performance accurately."
Offensive and Defensive Plus–Minus Player Ratings for Soccer,Lars Magnus Hvattum & Garry A. Gelade,2020,"The main aim of the work is to examine whether the individual plus/minus ratings obtained can be split into offensive and defensive contributions, thereby addressing the lack of defensive metrics for soccer players",52083,matches,"52,083 matches from 2008 to 2017",Global,Regression,Plus/minus rating models estimating offensive and defensive ratings,Aggregated Data,"starting lineup, time of goals, red cards, subs, players involved in red cards and subs, age, playing position",Player,Defensive and Offensive plus/minus rating models,Player Performance Related,"[1] New ratings perform almost exaclty the same as its predecessors as the regularization term for the overall player rating is similar. [2] Ignoring home advantage would lead to improvement in prediction loss. [3] Defenders are often older, lower market value (in relation to previous study), as attackers normally score low on their defensive ratings. ","[1] No contextualized information on the statistical data. [2] Home advantage is a difficult intangible factor to process. [3] Difficult to contextualize defensive ratings without relevant metrics, brings in potential errors when awarding players that play for bigger teams as long as they prevent goals."
Prediction of Football Player Value using Bayesian Ensemble Approach,"Hansoo Lee, Bayu Adhi Tama & Meeyoung Cha",2022,"This paper presents a predictive model for estimating football players’ market values using an optimized LightGBM model with Bayesian hyperparameter tuning. The model aims to address the limitations of traditional linear models by combining multiple data sources (SOFIFA and WhoScored) to create a robust, data-driven method for predicting player transfer fees.",2720,player,"2,720 players from the top four clubs in each of Europe’s top five leagues.",Europe,"Ensemble Learning , Bayesian Methods",LightGBM (Gradient Boosting) is used as the primary ensemble learning model for predicting market values.,Aggregated Data,"ability metrics, demogrpahic attributes, financial indicators, match performance metrics",Player,Predicted Market Value,Financial Related,"[1] The optimized LightGBM model achieved approximately 3.8 times lower RMSE than baseline regression models, demonstrating the efficacy of Bayesian tuning in improving predictive accuracy. [2] SHAP analysis highlighted “Overall Rating,” “Release Clause,” ""Age,"" and “Potential” as the top features, confirming the importance of these attributes in market value estimation. [3] Amongst playing attributes, a player's finishing  and their positioning is highly valued.","[1] Goalkeepers, may require tailored models due to unique metrics not fully captured in SOFIFA or WhoScored data. [2] As the SOFIFA dataset is derived from EA Sports data, the model relies on video game data, which, while robust, may not always align perfectly with real-world performance. [3] Although effective, the complexity of LightGBM with extensive hyperparameter tuning risks overfitting, especially if applied to smaller, less comprehensive datasets."
Dealing With Randomness in Match Outcomes: How to Rethink Performance Evaluation in European Club Football Using Expected Goals,Marc Brechot & Raphael Flepp,2020,"This study examines the use of expected goals (xG) as a more consistent and objective performance metric in football, aiming to reduce the impact of randomness on match outcomes.",7304,matches,"7,304 matches",Europe,Regression,Regression analysis to compare predictive power of the xG model against match results ,Event Data,"shot distance, position on the pitch, body part",Team and Player,xG difference ratings,Team Performance Related,"[1] The xG difference is a more accurate indicator of future performance than points won in past matches, as it accounts for scoring chances rather than isolated goals. [2] xG scores minimize randomness compared to actual goals, providing clubs with more stable ratings that support consistent player and team evaluations.","[1] The study’s xG model is simplified and does not factor in player-specific skills, defensive pressure, or contextual in-game factors, potentially limiting precision. [2] Focus on shot-based data excludes valuable non-scoring events, like defensive or midfield contributions."
